Rating,Reviews,Company,Province
1,"Share pengalaman menggunakan jasa JNE, saya dikirim paket oleh rekan dari tanggal 30 November, tgl 2 desember sudah sampai di bandar lampung, tgl 2 kurir wa kalau tidak bisa mengantarkan, oke saya balas tapi dia tidak respon, kemudian tiba …",JNE,Lampung
1,"Woy jebug paket gua mana muter² terus gak jelas, barang gak sampek keterangan sudah di terima
Lu kalo males nganter barang resign aja boss
Estimasi 3 hari udah mau seminggu gak sampek²",JNE,Lampung
1,Paket nya ga dianter kerumah alesan diluar jangkauan dan diluar kota jiiir rumah gw masih kota di bandar Lampung heloooow se umur umur beli online baru ini di suruh ambil digudang,JNE,Lampung
1,Setelah baca ulasan lain kasusnya sama dengan sy.. nama besar JNE tp palayanan bgini … paket sruh ambil sndri dgudang dengan alasan ga masuk jangkauan pengiriman…semoga cpt bangkrut,JNE,Lampung
1,Kurirnya gak respect ama pengantaran... Padahl bisa hubungi dlu utk pengiriman barng utk penerima.. skrng brang kita tidak smapai malah susah buat ngelacaknya... Butuh 3-4 hari...padahl yaa dlu jne ada yg terbaik dalam pengiriman skrng …,JNE,Lampung
1,Pake JNE yess sehari sampe KATANYA doang... pesan tgl 10 siang harusnya tgl 11 sampai tapi sampai tgl 13 lom sampe juga... ga ada nomor kurir jadi cuma bisa tracking resi... akhirnya tgl 13 pagi ke jne sudirman di bilangin paketnya di jne …,JNE,Lampung
1,"Maaf bukan nya gimna, tapi pengiriman JNE buruk bngt. Kerja susah gara"" barang yg di kirim gak smpe"". Cuma karna nunggu paket dri JNE doang.",JNE,Lampung
1,Sumpah ini parah amat. Tugas lu kurir ya anterin lah. Bukan penadah barang. Suruh konsumen ambil. Udah gila apa  tutup aja. Kasih kantor yg mencakup,JNE,Lampung
1,kaga jelas anjir masa disuru ngambil ke gudang ??? baru ini beli online mala disuru ngambil sendiri. Blokkkk,JNE,Lampung
2,"Aneh banget ini JNE ya!
Awalnya pesanan dalam pengiriman,tbtb dijadwalkan ulang
Eh besoknya dpt notif suruh ambl barang digudang dgn alasan diluar kota. …",JNE,Lampung
1,"Klo memang gak menjangkau semua alamat gak usah buka jasa pengiriman, buka warung makan aja. Pake pake acara ketahan karna luar area, konfirmasi dnk kurirnya jgan diemin aja oaket sampe beberapa hari gak ada konfirmasi mandek di Gudang, kan …",JNE,Lampung
1,"Baru kali ini pesen shopee disuruh ngambil sendiri di gudang, kalo ada di bawah bintang satu gw kasih di bawah bintang satu tengs bgt jne",JNE,Lampung
1,"ekspedisi goblok! gua nungguin di rumah paket gua g di anter2 padahal ada orang di rumah tapi keterangannya di shope pembeli tdk ada di lokasi jls jls gua nungguin, kalo g sanggup nganter gausa nerima paket banyak ajg! tutup aja kalo g …",JNE,Lampung
1,Paket gua belum sampe padahal kirim pake JNE yes ga sesuai. keterangan penerima gada orang rumah?? hellooo gue standby nih smpe jam 11 malem belum ada yg ketok gerbang anter paket. Abis baca ulasan ternyata emang bermasalah. gua tunggu …,JNE,Lampung
1,Paket yes dianter ga sesuai deskripsi sumpah jne ngaco mending tutup,JNE,Lampung
1,Gila banget kurirnya barang di bilang alamat penerima ga sesuai ga lengkap padahal lengkap. Cs di telpon bilang disiapin dulu barangnya awas aja kesana barangnya ga ada saya tuntut ekspedisinya,JNE,Lampung
1,"Berengsek emang jne ini,ngirim paket obat yes dari jakarta mahal2 supaya bisa segera di minum obatnya,tdk terkirim dan ga tau barangnya ada di mana sampai skrg...setaan bener org2 yg kerja di yes ini..jgn minta ongkir mahal dong kalau tidak …",JNE,Lampung
1,Ngirim dari tgl 10 pas di cek sudah sampai di lampung tgl 11. Sampai tanggal 17 tidak ada tindakan pengiriman akhirnya diambil sendiri.. Ntah apa masalahnya MALAS nganter atau apa ini kok lemot,JNE,Lampung
1,"GILA APA YAA, paket gua stuck 3 hari disini cokkk
Ga di kirim kirim anjirr …",JNE,Lampung
1,Jne ini sangat buruk lama masa pesan di bandar Lampung dr hari Minggu smpai skr masih blm di antar ke alamat uga ...bnr2 GK ad bgusnya ini JNE smpai di bandar Lampung di sortir di bandar Lampung sampai di pusat b Lampung di sortir di …,JNE,Lampung
1,"Tanggal 19 sampai di werehouse, tanggal 25 baru di antar ke lokasi. Box kardus di sobek dengan sengaja dan di masukin barang yg bukan milik saya. Ga lagi lagi pake ekspedisi ini. Kalo ga kepepet ga bakal kemarin pake ekspedisi ini.",JNE,Lampung
1,"pake yess lama masa 4 hari dari sebrang parah kualitas nya lelet, terurama drivernya kerja nya suka bohong bilang dah d titip d pos gk tau nya blm",JNE,Lampung
1,"Kurir ga amanah, kasian penjual klo kyk gini, ga konfirmasi tiba² bilang klo pembeli menolak bayar😌😌
Nelpon juga ga👎👎👎👎 …",JNE,Lampung
5,"Gudang JNE Lampung khusus barang masuk. Anda bisa mengambil sendiri paket JNE anda yang sudah berstatus ""Received in warehouse"" di sini. Cukup menyebutkan nomor resi dan KTP/SIM asli. Berada di Jl. Alimudin Umar daerah Campang Raya, …",JNE,Lampung
1,"Pengiriman gak guna, baru ini ada ekspedisi yang gk amanah untuk kirim barang, padahal barang itu dibutuhin, cs dihubungin juga kagak respon!!!! Bikin kecewa gak gak lagi pake jasa pengiriman ini!!!! Bikin laporan juga gk digubris oleh pihak cs!!! GAK GUNA PUNYA EKSPEDISI GEDE KALAU GK AMANAH!!!!",JNE,Lampung
1,"Paket tidak di antarkan ke lokasi dg alasan tidak masuk wilayah kota dan berparokan hanya gapura, tidak dilihat lokasi.",JNE,Lampung
1,"Jasa kirim paling SAMPAH, paket gk gerak gerak udah 4 hari",JNE,Lampung
1,emg tolol amat dah paket gw belom nyampe malah tulisannya udh sampe ko mau maling kreatif dikit napa tolol amat malingnya paket tutup aj tolol cabang yang ini nyusahin doang,JNE,Lampung
1,"Tolong anterin paket saya,klo ngak niat jadi ekspedisi tutup aja mending ,ngak bertanggung jawab.",JNE,Lampung
1,"paket ketahan disini 3 hari , akhirnya ambil sendiri kesana , customer servis nge read doang keren banget",JNE,Lampung
1,LEMOT DITUNGGUIN SEHARIAN DEPAN RUMAH SMPE BOSEN GK DTENG DTENG PDHL NOTIF CEK RESI UDAH SAMA KURIR. GAJELAS INI EKSPEDISI. LAMA DOANG BUKANNA IMPROVE BUAT BERSAING SAMA EKSPEDISI LAIN MALAH MAKIN JELEK,JNE,Lampung
2,"""Tak ada Ditempat, Telepon tak direspon""
Emang betul saya gak ada dirumah. tapi gak ada tuh yang nelpon saya ,yg bener aja courier kocaklah🤣 …",JNE,Lampung
1,"Salah lokasi ambil barang yg udh 1 mggu ga jelas,,,rupanya dsini buat yg express. Gudang kargonya ga jauh dr perempatan lampu merah by pass. Pelayanan jne lg buruk bner akhir2 ini..kapok",JNE,Lampung
5,Bagus ga lambat kaya di komen kurir ramah semangat trus JNE 🙏🙏 …,JNE,Lampung
2,paket udh tau salah alamat bukan nya konfirmasi saka pembeli malah maen return aja,JNE,Lampung
1,"paket ditunda tunda, di hubungin juga respon nya lamban.
udah request barang di ambil aja biar cepet, malah dibilang bakalan di anter, tapi masih juga ga di anter2. perfect",JNE,Lampung
1,Katanya gak masuk rute dia jadi tuh paket gak dikirim² kalo mau kaya gtu mah menghambat orang jadi nya,JNE,Lampung
1,"percuma bayar paket YES sehari sampai, pembelian tanggal 3 janji paling lama sampai tanggal 5, ini sudah tanggal 5 barang tidak sampai sampai, saya tunggu dari pagi sampai malam ini tidak sampai sampai mana ini profesionalitas nya",JNE,Lampung
1,pake YES udah 3 hari lebih belum juga sampeee!! gimana ini ? tolong bantuannya bos,JNE,Lampung
1,Paket telat mulu.. harus dijemput ke gudang.,JNE,Lampung
1,Barang saya sudah dari tanggal 20 juni sampai hari ini tanggal 26 juni belum dianter ke alamat. Sudah hubungi cs berkali² tidak ada tindak lanjut. Kalo ada pilihan ekspedisi lain mending pakai ekspedisi lain. JNE selalu mengecewakan.,JNE,Lampung
1,"Ini jne sangat buruk.jasa kurir menghilangkan paket fgn alasan yg tdk masuk akal.
Paket sdh bayar  tapi barangnya hilang tdk ada kejelasan.kecewa",JNE,Lampung
1,paket saya ga dianter anter padahal isinya makanan gatau udah jadi apa itu,JNE,Lampung
5,"Mungkin saya beda ya. Estimasi tgl 2-7 Mei tibanya tgl 3Mei. Udh 2 Kali pakai ini ekspedisi ternyata gk sesuai sama rating. Cpt cpt aja, barang saya gk ketahan atau apapun. Dibanding sicepat Ngirim melebihi batas waktu estimasi. Luv JNE. …",JNE,Lampung
1,"Parah banget sih ini, paket sudah tiba di bandar lampung dari tanggal 20, sampai sekarang blm sampai. Laporanya gak ada orang dirumah, padahal orang nya 24 jam dirumah.",JNE,Lampung
1,"GA GUNA EMANG JNE INI
DISURUH NGAMBIL SENDIRI KE CAMPANG RAYA? HELLO APA GUNA BAYAR JASA EKSPEDISI TOLOL!",JNE,Lampung
1,"ekspedisi paling ribet ya cuma jne, perbedaan wilayah antara balam n lamsel padhal tetangga depan
rumah balam, tp gk mau anter pket alesan beda wilayah …",JNE,Lampung
1,"Jelas2 ksna mau ambil barang ktnya barang blm siap, bsok disuruh balik lg. eh....... Malam status dibuat sudah tiba di tujuan, tanya2 siapa tw ada yg nerima pas kmi ga ada drmh tp ga ada yg Terima, di complain ke CS ktnya maksudnya barang …",JNE,Lampung
1,"Lucu paket disuruh ngambil sendiri, udah bauar juga disuruh ngambil sendiri 🤣 …",JNE,Lampung
1,"Pake yes sehari, tp ga dianter dalam sehari pdahal udh smpe.
Besok pagi2 nlfn cs minta disiapkan paketnya di wearhouse biar ambil sendiri, kata cs udh siap tinggal ambil aja …",JNE,Lampung
1,"Barang berangkat dari jakarta tanggal 7 , tanggal 7-11 mei smpai di sortir center ntah mana itu , udah di tlvon cs nya udah di laporan sana sini , hari ini baru update barang di warehouse ini , OMG 10 hari hello ???
Udah lewat estimasi barang belum juga di anter",JNE,Lampung
1,"ga jelas bgt pelayanan nya barang dilempar sana sini l, bad information",JNE,Lampung
1,"2x sudah dikecewakan dengan modus yg sama, PENERIMA LUAR KOTA padahal masih area bandarlampung dan status ketika dicek secara online HOLD, nomor telp jg tidak ada yg bisa dihubungi",JNE,Lampung
1,"HARUSNYA EKSPEDISI KAYA GINI TUTUP AJA SI, BANYAK NYUSAHIN ORANG",JNE,Lampung
1,"emang pada males ya karyawan jne ini, paket udah 3 hari disini gak di anter” ke alamat. barang udah keburu mau dipake. pas liat review bener aja memang ekspedisi PROBLEMATIK",JNE,Lampung
1,"paket saya sudah 2 hari nginep di warehouse ini, tidak di kirim"" kan ke rumah, semakin kesini pelayanan JNE semakin mengecewakan",JNE,Lampung
1,"Parah bener nih JNE,,,banyak bikin kecewa nya dr pada puas,,,paket selalu terlambat dalam pengiriman,,,kalo ga sanggup bubarin aja sudah",JNE,Lampung
1,"setelah liat review review nya awal gapercaya eh bener aja paket ditahan lama banget padahal udah sampe di balam tapi ga dikirim kirim, masa lebih cepet jakarta-balam daripada balam-balam, :)",JNE,Lampung
1,"Dulu JNE paling rekomended, sekarang ampas. Dari tgl 22 sampe tgl 27 paket tidak sampai2, liat dari aplikasi status ""nobody at home"", dan yg ke 3x nya "" Alamat tidak jelas"". Itu kurir buta huruf atau males nganter? Kan dicantumkan nomer teleponnya. Alamat tidak jelas kan bisa ditelpon. Inimah status alasannya semau kurirnya.",JNE,Lampung
1,"Kurirnya pada males, gak mau nganterin paket... Kita yg di suruh ambil.. tutup aja boss kalo gini terus.. sudah 2x paket pake JNE disuruh ambil sendiri tutup aja loe..",JNE,Lampung
1,"Kurir demen bgt bw bw barang ngk di anter2  sampe nunggu 2 hari.terulang lagi terulang lagi ..mana ngk ramah pula .ngapain di bw klo ngk sanggup anter ...kurir wilayah tanjung gading lelet ngk ada senyum (nih paketnya ,,!) ketus bahasanya nya aturan aku kasih tip jd masuk kantong lagi dah...",JNE,Lampung
1,"Paket saya ketahan 4 hari di warehouse, gak ada pergerakan sama sekali, total pengiriman 10 hari, paling lama sih, padahal ke kantor doang niatnya supaya sampai dihari kerja senin-jumat gak juga sampai, sengaja jumat tunggu sampai sore jam …",JNE,Lampung
1,"Alamat saya way kandis, dulu pke JNE dianter sampe rumah, pake ekspedisi apa pun dianter ke rumah. Tp keterangan CS Jne ga dianter krna masuk daerah lamsel. Kocakk bangett!!",JNE,Lampung
1,"Lamaaaaaaa
statusnya di gudang
Di samperin suruh ke cs va/phone …",JNE,Lampung
1,"TOLONG BUAT PIHAK JNE TERUTAMA UNTUK WILAYAH RAJABASA. DARI JAM 8 DIBAWA KURIR SAMPE SEKARANG BELUM JUGA SAMPAI. UDAH TAU SPERPAT MOTOR. MAU DANDAN MALAH GAK DIANTER"" . NYESEL PAKE JASA JNE INI KURIR NYA PADA GAK JELAS",JNE,Lampung
1,Karena otomatis dari aplikasi yg tentukan ekspedisi makanya pakai JNE. Kalau bisa pilih sendiri pasti saya pakai yg lain. Meskipun sudah puluhan kali pakai ekspedisi ini tetap saja waswas. Sudah feeling ga nyaman pakai JNE karena saat covid …,JNE,Lampung
1,"Dah 2 hari barang masih disini..
Hey pak kurir barang keburu mau dipakek
Gak akan pake jne lagi kualitas pengiriman buruk sekali",JNE,Lampung
1,"Kacau, bberapa kali trouble dg case yg sama. Jelas2 alamat yg ditulis sudah sngat sesuai dg kondisi real, tpi mngkn emang dasar males kalik ya nganter smpe rumah. Keterangan diantar kurir tp tdak smpai2, trs tdk ada konfirmasi apapun dri kurir. Perlu bnyk skli evaluasi, dan mohon tnggung jwb dlm bekerjanya lbh ditingkatkan.",JNE,Lampung
2,"hai! kau lihat tulisan ini karena kenapa POS JNE bagian Warehouse lama?
iya! kita samaan cuy. ku lihat dari komentar sebelumnya katanya ""Overload"". aku tulis komentar ini waktu musim mau bulan puasa. wajar aja si.",JNE,Lampung
1,"Kecewa.Didatengin ke gudang mau ambil paket karena udah 5 hari ga dikirim kirim, pas udah sampe sana katanya tutup padahal jelas jelas buka.Ga bisa ambil paket katanya.Kalo gabisa diambil ya cepet kirim.",JNE,Lampung
1,"Ini perusahaan mau bangkrut, masa paket kita gak di kirim... Alasannya di luar jangkauan.. parahhh.... Padahal di deket rumah gw ada agen JNE... Parahhhh...",JNE,Lampung
1,Gua klo bsa ga ngsh bintang anj paket gua di kembalikan ke penjual pdhl gada telpon kurir mau antar wkw udh nunggu lama semoga urusan lorang gadipersulit ya,JNE,Lampung
1,"Kalau ada bintang minus, saya kasih minus, kecewa bangeeeeeetttttttttttttttttttttttttttttttt sama pelayanan JNE.
Barang sudah dibawa kurir, ada kendala tapi sama sekali tak menghubungi penerima …",JNE,Lampung
5,amanah kurir nya ramahh,JNE,Lampung
1,"Saya kecewa sama JNE paket saya sudah keterangannya diantar ke alamat tujuan sorenya gagal dikirim mau dikirim besok, giliran mlm malah dibalikin ke penjual,kalau supirnya gak ngerti alamat gak ngerti jalan tuh nelpon aja itu kan ada nomor …",JNE,Lampung
1,"Jne paket saya sudah dari tgl 18 di gudang sampai skrng gk dikirim kirim sudah lewat estimasi
Tolong dong dikirim, tolong dipikirkan gimana perasaan cust yg harap-harap akan paketnya. Harganya juga tidak murah, tolong segera dikirim.",JNE,Lampung
1,"Memang benar"" expedisii gak jelasss !!! Klo gk mau nganter paket jgn buka expedisiiii !!!! Untuk apa mesen online kalau harus ngambil paket sendiriii sejauhh itu di suruh ambil sndrii emg go*blok nih expedisii !!!! TUTUP AJAA GK USH BUKA LAGI!!!",JNE,Lampung
1,"Ga nyangka expedisi sebesar jne kok ga bisa nemuin alamat.. udah lama ga kekirim juga,.. suruh ambil sendiri,.buat apa gw belanja udah pake ongkir klo ga kekirim.. parahhhh.... ga lagi pake JNE..👎 …",JNE,Lampung
1,"Pengiriman lamaa !!! Barang sudah smpe dilampung aja nganter berhari- hari
Kirim airfryer sesama lampung jg bisa ilangg !!! Pekerjany pada maling & males kerja",JNE,Lampung
1,pelayanan buruk bgt paket udah sampe dr hari senin cek resi estimasi dikirim hr kamis oke ditunggu tp gak di anter juga akhirny hrs di ambil sendiri..kalo malesss kirim jangan buka expedisi !!!!!!,JNE,Lampung
1,"waduh, bayar mahal mahal untuk sehari sampe malah stuck disini
ngomongnya di rumah tidak ada orang, padahal ada, tidak ada konfirmasi melalui wa juga kalo sudah didepan",JNE,Lampung
1,"niat kerja ga sii,kali ga niat gausah buka!!,nyusahin orang ajaaaa najissss!!!!",JNE,Lampung
1,Bener bener BURUK ini JNE. Udh 1 jam lebih menunggu sampe Jam 13.00 mau ambil barang bilangnya lg pd istirahat sampe jam 13.30 msh pada nongkrong ngobrol blm masuk jam operasional juga. bnyak pelanggan yg antri mau ambil barang gk di layani saling lempar suruh tanya sana tanya situ. attitude pegawai gudangnya sangat rendah.,JNE,Lampung
1,"Sampah emang JNE ini,  dari jam 3 sore sampe hari berikutnya barang belum sampe juga. Padahal pakai JNE YES.
mahal biaya tapi pelayanan SANGAT LAMBAT !!
SANGAT GA REKOMEN BANGET !!!",JNE,Lampung
1,"3x paket g smpe kerumah, ggal dikrim mlah direturn, gatau sebab nya apaaaa hadeehhhhhhhhhhhhhhhhhhhh",JNE,Lampung
1,"Kecewa banget sih udh 3x pengiriman di return terus,, ga ada kejelasan Sma sekali padahal ada wa tercantum tapi ga di kabarin asal saja langsung di return ga bertanggung jawab",JNE,Lampung
1,"gila parah..pantesan 4 kali belanja online pakai jne gak pernah sampai rumah dengan dengan alasan tidak masuk akal, ternyata lihat komen komen di maps kinerjanya sangat buruk sekali.mestinya kalau sudah tak sanggup tutup saja. mengecewakan banyak orang.",JNE,Lampung
1,Barang udah dari tanggal 24 sampai di warehouse skrg udah tgl 26 barang belum juga di anta. Parah banget sih,JNE,Lampung
1,"Paket gak dianter-anter berhari-hari. Ngasih alasan alamat tidak lengkap, trs besoknya beda lagi. Gitu terus. Tapi gak ada konfirmasi alamat atau hubungin kalo emg gak lengkap. …",JNE,Lampung
1,"Pelayanan tidak memuaskan, ekspedisi jne sudah mulai lemah
tidak ada niatan juga mau memperbaiki soalnya sudah bertahun² seperti ini",JNE,Lampung
1,"Tutup aja JNE klo tidak bisa jaga barang orang, baru ini barang saya di tahan tahan sama bea cukai bandar lampung cuma seharga 21rb doang aja di tahan",JNE,Lampung
1,Gak banget JNE mending jnt alamat geser dikit aja ga mau nganter gada pengiriman kaya gini kecuali JNE,JNE,Lampung
1,Pengantaran nya gimana lah ini lambat bangetttt,JNE,Lampung
1,"Laptop Uda sampe dr tgl 19 digudang bukan segera dikirim malah ngendep 4 hari sampe skrg blm dikirim2...sumpah nyesel bener pke JNE truking ini, niatnya biar aman ditambah pke kayu tp malah selama ini diendep digudang...Uda wa cs ambil sendiri tp konfirmasinya lama bnr...niat ga sie... astaghfirullah",JNE,Lampung
1,Sudah 2 bulan terakhir ini performance JNE khususnya JTR ancur... apakah JNE akan segera menyusul sicapit terkait kepuasan konsumen..,JNE,Lampung
2,"Gimna sih JNE ini mkn nggk jls, pdhl pengiriman nya 2day tapi d keterangan nya nobody at home jelas² drmh saya ada orang dan kta mba saya nggk ada kurir yg dtng payah bngt JNE ini kinerjanya",JNE,Lampung
1,"JNE YES ( YAKIN ESOK SAMPAI ) ITU DULU KALO SEKARANG JNE YES ( YAKIN EnGGk sampe"" ) lama banget sumpah kecewa panresan jne kalah sama kurir laen",JNE,Lampung
1,"Kalo bisa -100 , saya kasih yg paling buruk deh ratingnya",JNE,Lampung
1,"Sumpah demi apapun parah nih JNE, masa udh 7 hari ga sampe², ya walaupun Cargo seharusnya ga segini, tolong dong Kurir ditingkatkan lagi lah kinerja nya, baru ini soalnya ada expedisi seperti ini, jadikan pelajaran & pengalaman setelah ini pikir pikir dulu lah pake JNE",JNE,Lampung
1,"Udah sampe gudang dari lama ga dianter2 sampe 3 hari, progres pengiriman paling lma jne ini , tolong lah jasa lain ga sampe lama gini",JNE,Lampung
1,Paket sudah d kurir tapi belum di anter oi . gw nungguin sampe skrg gada kabar .tungkat kan lagi pelayanan jne ini .jangan aneh2 ini paket dagang buruan di anter kalo gak bsa anter hubungin saya viar saya ambil sndri,JNE,Lampung
1,EKSPEDISI TERGOBLOK! SENENG BANGET NUMPUKIN PAKET ORANG DI GUDANG! PAKET UDAH 7 HARI MASIH GAK GERAK2! UDAH KAYA NGELAYANIN JASA KE LUAR NEGRI LU! KALO KURANG KARYAWAN TAMBAH! KALO GAK SANGGUP NERIMA PAKET BANYAK TUTUP! JASA ANDA DI BAYAR …,JNE,Lampung
1,"Jne yes udh lbh dari 24 jam g nyampek2, ngambil ke gudangnya infonya sudah ke kurir, komplain ke cs pusat infonya alamat tidak lengkap trz mau sampe kpn di ping pong barang gk nyampek2, wa kurir juga g dibls",JNE,Lampung
1,"Jasa pengantaran terburuk, ngasih alasan ga masuk akal , sarankalo order jangan pake ekpesidisi ini, terlalu BUSUK",JNE,Lampung
1,Wey JNE bandar Lampung ke metro waktunya 24 JAM KAH. Lambat Bet,JNE,Lampung
2,Paketan udh sampai JNE. Tapi kenapa tidak di antar ke alamat penerima.   Dan ressi pun slalu  with delivery Courier  truss,JNE,Lampung
1,Kurirnya ga amanah. Dr jam 9 pagi paket di bwa smpe jam 7 malam belum sampe.. dan no kurir tidak punya,JNE,Lampung
1,"Parah sih paket ga ada pergerakan sama sekali padahal udah 3hari, kantor expedisi nya buka 24jam tapi paket ga dianter ke tujuan selanjutnya
Kalo gini bener2 kapok pake expedisi Jne cukup kali ini aja.",JNE,Lampung
1,"Estimasi pengiriman padahal cuma 4hari,tapi udah hari ke 6 masih stuck di gudang aja..JNE PARAH !!!",JNE,Lampung
1,"JNE paling lemoot, kalau saya beli online saya bilang sama penjualnya jangan pakai JNE.
Pengalaman saya udah berapa kali paket lelet banget nyampe nye, bahkan pernah …",JNE,Lampung
1,"Lo kalo ga niat kirim , tutup aja gerai nya . Mending shopee expres . Jauh bener pelayanan nya sama shopee expres",JNE,Lampung
1,"Barang sampe gudang tgl 8 , tgl 12 belum di anter juga, dan sudah banyak komen begini, ini jne gak ada evaluasi nya ya ?
Kayak bukan perusahaan besar",JNE,Lampung
1,"ini karena dari official web nya otomatis pake JNE, saya pake JNE...padahal dari bandarlampung kota ke kemiling, tapi gak nyampek2...emang dasar malas atau gimana coba",JNE,Lampung
1,"Tolong lah paket saya dianter, udh 5 hari gak gerak juga, JNE memang bermasalah sih",JNE,Lampung
1,Padahal dirumah ada org tpi malah keterangan nya rumah kosong padahal tinggal telpon kan ada nomor nya sih,JNE,Lampung
1,"kerjaan semua pihak JNE sangat lelet banyak orang, banyak mobil dllnya tetepi kerjaannya terlalu lelet",JNE,Lampung
1,"Sudh 3 hari paket di bawa kurir, ga sampe2 nth di bawa ke mana, hari prtma bilang alamt tidak jelas hari ke dua di bilang ga ada org di rmh hari ke tiga di sruh kasi alamt trbaru, heyyy jne di stu sdh sy tlis alamt sejlas2ny di rmh jg …",JNE,Lampung
1,Ekspedisi paling gilani. Barang blm sampe tangan tapi di sistem nya tulisannya sudah sampai kpd yg bersangkutan. Kabur kemana paket gw?????,JNE,Lampung
1,PELAYANAN BURUK.. PAKET TIDAK SAMPAI!,JNE,Lampung
1,"Terakhir pakai jasa ini gamau lagi, barang udah beberapa hari di gudang koo ga diantar antar, ekspedisi lain barang sampai gudang langsung antar lokasi, perbaiki pelayanannya jelek banget.",JNE,Lampung
1,"Kasih lah penjelasan jam operasi, kasih keterangan ini gudang apa dan beda dgn gudang yg kargo.",JNE,Lampung
1,Tolong bgttt paket saya segera dikirim ya. Penting dan dibutuhkan bgt 😞. Kalau dah dikirim nanti bintangnya nambah jadi🖐️ …,JNE,Lampung
1,Kurir taik barang gk nyampe,JNE,Lampung
1,"Kinerja buruk. Barang sampai warehouse dari tanggal 16 sampe 2 hari gak diantar2 ke alamat, gimana sih? Trua besok libur alamat bakal lusa dikirim. Kemaren dibilang tidak ada dirumah. Tolong lah kinerja kurirnya diperhatikan. Kecewa sekali. Klo ada dibawah bintang 1 saya kasih dibawah bintang 1!!!!",JNE,Lampung
1,"Ni jne ampas banget dah blm dateng ke tempat gw aja di tulis no body at home, nelpon kagak nge hubungin kagak, nge batalin ngerim paket nya. Kocak banget dah. Gw saranin jgn pake jne guys !!",JNE,Lampung
1,"Sangat pantes dpt bintang satu. Karna pelayanan buruk, paket ga sampe sampe malah diputer puter ga jelas sama kurirnya. Paketnya saya itu bukan barang murah. Klo rusak siapa yg mau tanggung jawab. Apa susahnya sih kurir suruh kontak ke WA …",JNE,Lampung
1,Kirim KTP dari Tangerang pake JNE YES . Dua hari baru sampai. Bikin rugi,JNE,Lampung
1,"Proses ribet, barang ga di kirim2, barang di gudang, minta di antar, malah bilang blm ada jadwal, pdhal sudah lewat waktu estimasi, mau ngambil juga di persulit, sangat tidak recommended, kapok, pelayanan nya juga sangat2 slow respon, bener2 buruk",JNE,Lampung
1,"Kecewa sama kurir JNE , Buat Status palsu.. Paket Di tunggu orang rumah.. Tapi di status tunda pengiriman karna penerima tidak ada orang di rumah !!!!! Tolong di cros cek kurir nya ya.. Jgn sampai hilang pekerjaan karna Kerja tidak Profesional !!!! Terima Kasih @csJNE",JNE,Lampung
1,"kirim woiii pakett sayaa ini kah, udh stuck aja dsni 4 harii, mauu di ambil apa gmna sya byar udh transfer eh ini mlah ga dkirim"" kmren pas dri jkt cpt pas udh dsnii lama betttt",JNE,Lampung
2,"Kak tolong dong paket nya cepet dikirim masa menuju lokasi tujuan trs dari hari sabtu tapi gak dikirim2 sampe sekarang. Malah bilang NOBODY AT HOME / OFFICE TO RECEIVE SHIPMENT ngada2,Padahal lokasinya deket dari gudang loh kak,paketnya …",JNE,Lampung
5,Mohon segera kirim paket saya kak..jgn lama2 d gudang.. ulasan sebelum saya pada ga bagus.. semoga lebih baik..trimakasih...,JNE,Lampung
1,lama banget yaa barang saya dri tanggal 25 smpe di gudangnya smpe skrng belum dikirim²,JNE,Lampung
1,"Pengiriman sangan tidak baik .
Jika tidak mau kirim setidaknya hubungin lah nomor telpon di paket . Sudh ada jelas nomor di cantumkan. Barang sngt di butuhkan malah di kembalikan . Kita bayar lo . ga grtis .
Parah sangat jne",JNE,Lampung
1,"gak rekomen, mending ekspedisi lain.",JNE,Lampung
1,Tolong dong pak kurir Jne. Paket saya sudah 3 hari gak bergerak dari gudang bapak. Barang mau segera di gunakan pak. Tolong jangan mengecewakan pelanggan dong,JNE,Lampung
2,"Kirim paket dari surabaya ke lampung dari tanggal 10,tanggal 13 sudah sampai gudang alimudin dan sampai tanggal 17 stay di sini g ada pergerakan padahal pakai reguler,ngapain paket di tunda2,padahal isinya makanan dan orang rumah sudah nunguin paket nya tapi nyantol di sini g di kirim2,👎 …",JNE,Lampung
3,"Dikerjain JNE karena barang kami nyelip katanya. Keterangan di web, barang diantar kurir. Tapi 2 hari koq gak sampai juga, alasannya kurir gk tau alamat. Heloo apa guna google maps, rmh kami juga di kota. Akhirnya kami telp call center dan …",JNE,Lampung
2,"Paket dari tgl 1 udah di gudang gak sampe-sampe rumah,di telpon dong mas gak ada kabar",JNE,Lampung
1,Ya kurir nya jne pada belagu semua gaya nya padahal setiap nganter barang pasti saya kasih tips.barang sudah dibawa kurir kok belum sampe sampe juga ke alamat rumah.minta kontak kurir biar bisa janjian dimana bilang gak ada pelayanan tidak sesuai SOP,JNE,Lampung
