Rating,Reviews,Company,Province
1,"Pengiriman tidak pernah tepat
Sudah beberapa x pake pengiriman ini selalu lama
Atau gak sampe k rumah jam 11 malam . …",JNE,Jawa Barat
1,"Telat kasih ulasan untuk JNE Galuh Mas

JNE YES (Yakin Esok Sampai) …",JNE,Jawa Barat
1,"Paket gasampe sampe udah lebih 3hari dari estimasi, tiba tiba gagal pengiriman dan catatannyaa pelanggan menolak untuk membayar. Woy anda datang kerumah saya saja tidak yaa! …",JNE,Jawa Barat
1,"Hari ketiga, aket dibawa kurir tapi gak sampe sampe padahal alamat udah lengkap, nomer telepon aktif, tapi keterangan alamt tidak lengkap. Gak akan lagi pilih ekspedisi JNE biarpun free ongkir. Bad",JNE,Jawa Barat
1,jne pengiriman terburuk sih..3x paket d antar ke tujuan..gagal terus..dengan alasan alamat tidak sesuai..padahal kurir lain tidak pernah tuh nyasar..alamat masih sama padahal..tolong pelayanan nya d perbaiki lagi..,JNE,Jawa Barat
1,woyy anterin paket gw weyy. setiap paket gw di lewat kirim ke JNE pasti lama.. padahal udh sampe di gudang nya tapi lama trus sampe 2/3 hari di gudang nya ajah.. pada becus kerja ngga sih lu,JNE,Jawa Barat
2,"Pakenya lama sampe, udah 2 hari diantar ke alamt tujuan. Pas hari pertama infonya tidak ada orang dirumah, jdi dikirim besok, padahap seharian ada dirumah, udah 48 jam ga sampe2 😑 …",JNE,Jawa Barat
1,Kenapa status pengirimanya gagal kan disitu ada no telponya kenapa ga telpon ajan malah gagal saya udah tungguin paketnya sampai jam 10 malam dari jama 1 siang...parah mendingan tutup aja jne ketimbang merugikan orang,JNE,Jawa Barat
1,"Maaf sebelum nya,saya sangat kecewa sekali dengan pelayanan pengiriman paket pas pengiriman ke rumah, estimasi 2 hari sedangkan paket sudah telat 3 hari belum sampai juga ke rumah, padahal saya sudah me respon titik lokasi rumah saya,toh …",JNE,Jawa Barat
1,"Baru kali ini sih pengalaman yang sangat menyebalkan .
Kan di ekspedisi nya 2 - 3 hari sampai. Lah kemaren di gudang JNE galuhmas aja 2 hari gak gerak. Terus giliran status udah diantar udh ditungguin sampai malem …",JNE,Jawa Barat
1,"Paket saya tidak di kirim2, pdhl waktu sampai harusnya tgl 4, smpe skrg pun tak kunjung datang, keterangnya alamat tidak lengkap, pdhl ada nomor tlpon saya tinggal WA aja. Gak profesional,",JNE,Jawa Barat
5,"Beberapa kali kirim paket dari sini. Biasanya saya kirim kamera Gopro menggunakan layanan Yakin Esok Sampai (YES) dengan packing kayu dan asuransi. Pelayanannya sangat baik, pegawainya mampu mengemas barang sesuai dengan permintaan saya …",JNE,Jawa Barat
1,"Paket dari tgl 7 sampe tgl 14 januari 2025 belum  nyampe2, pelayanan jne dari dulu sampe sekarang gk ada perubahan. Jelek, titup aja jne gk guna",JNE,Jawa Barat
1,"Ga pernah Ontime selalu lewat batas estimasi + sikap kurir tidak Ramah Berkata² buruk Tidak sopan, Kurir tidak Berpengalaman tentang alamat,",JNE,Jawa Barat
1,"Pelayanan buruk sekali. Banyak paket yang tertunda disini. Saya pernah coba ambil paket disini, ternyata banyak orang yang mengalami hal serupa. Antrian banyak dan membludak. Pelayanan sangat lama. Ruangan pengambilan paket sangat sempit …",JNE,Jawa Barat
1,"Riwayat barang kalo udh sampe sini, dipastikan sampe ke penerima bakal lama lagi. Ga becus kalo kerja. Ini management nya atau karyawan nya yg harus diganti. Kasian JNE jd tercoreng. Padahal alamat lengkap nomor telepon juga ada. Apa susahnya WA ke nomor penerima. Goblok banget yg kirim paket",JNE,Jawa Barat
1,"Kayanya pelayanannya emg busuk ni JNE sini. Kirim dri tgl 13, pgi ini cek statusnya malah alamat tidak lengkap/tidak dikenal padahal udh nulis alamat lengkap bgt dan cantumin nomor hp penerima. Baca2 review yg lain jga banyak yg …",JNE,Jawa Barat
1,"JNE paling payah, kacau.. jangan pake ekspedisi ini.. paket dr tgl 12 sampe tgl 18 belum nyampe. Harusnya Nyampe tgl 15. Yg alamat tdk ditemukan. Yg alamatnya salah lah. Kurir dtelp ga direspon. Kapok ngga lagi pakai ekspedisi ini. Sangat tidak profesional..",JNE,Jawa Barat
3,Kenapa jne kualitas semakin buruk dalam pengiriman paket selalu terlambat padahal saya pesan paket tanpa gratis ongkir.,JNE,Jawa Barat
1,"Paket udah di warehouse 2hari, di ambil sendiri gak bisa,katanya lagi di sortir. Katanya mau dikirim, eh ditungguin gak dateng2 ... Tutup aja udah kalah ama yg lain pelayananya. Kalo bisa milih jasa ekspedisi gak bakal pilih jne. Bayar pun gpp .......",JNE,Jawa Barat
1,"Judul pengiriman YES, namun barang datang sama saja seperti Reguler. Mohon diperbaiki, apakah traffic terlalu padat atau kendala di system??",JNE,Jawa Barat
1,"Paket dari toko sesuai pengemasan 4 barang
Pas sampe cuma 3 barang
Tolonglah jne jngan ambil yg bukan haknya …",JNE,Jawa Barat
1,"Jne kurang propesional. Paket orang tidak di sampein , malah di kirim lago ketokonya",JNE,Jawa Barat
1,"Gajelas, paket 3 hari statusnya alamat tidak ditemukan. Ada kurir yang WA, dari pagi ga sampe² ini paket.!! CS dihubungi gada di angkat, mending hapus layanan CS aja deh",JNE,Jawa Barat
1,Paket sudah di kurir 2 hri gk sampe2. Pdhl alamat jelas dan ada no. Hp kan kl gk tau lokasinya bisa wa/tlfn mlh di noted alamat tidak lengkap pdhl udh lengkap bgt  LAWAK GAK TUUUH???!!!,JNE,Jawa Barat
1,"Emng ini sengaja apa gimana sih kurirnya, paket udh nyampe di gudangnya, dan tulisan kurir sedang mengantar, tapi sampe 2 hari blm nyampe² , alasan alamat tidak valid matane",JNE,Jawa Barat
1,"Parah. Paket sudah dibawa kurir, tapi entah kenapa gagal dikirim. Trus diantepin di gudang.. eh baru 2 hari kemudian dikirim.
Dahlah pindah ke JnT aja.",JNE,Jawa Barat
1,"Lamaaa, pelayanannya kurang all out, gamau ngusahain nyari barang yang mau diambil. Very bad 👎
Edit: emang tolol asli kurirnya, gapaham lagi dah 🤦 …",JNE,Jawa Barat
1,"Sangat buruk .
Sangat tidak layak untuk jasa pengiriman barang.
Setatus Barang tidak diketemukan alamat. …",JNE,Jawa Barat
1,"Gajelas banget JNE galuh mas ini. Haha hihi doang. Gak recomended banget pokonya buat warga karawang mending pakai ekspedisi lain aja. Paket gk jadi d antar dg alasan alamat tidak ditemukan/tidak lemgkap. Tai lah, sebelumnya gw ada paket …",JNE,Jawa Barat
1,Paket hilang didatengin ke gudang ternyata diambil oleh leadernya udah 2x kejadian kaya gini. Jne bukan belajar malah makin jelek banyak pencuri,JNE,Jawa Barat
1,"dr dl selalu telat nyampe customer..pdhl paket yes yg sehari hrsnya nyampe..ini udah hari ketiga dan sudah sore jg, tp paket blum sampe2.itu sengaja pake yes Krn Frozen food.klo emang ga bs mengestimasi kpn sampai k customer tepat waktu. ga …",JNE,Jawa Barat
1,"Jne kagak jelas pengiriman dari Bekasi ke Karawang mau seminggu belum sampe2 . Alamat sudah d tulis lengkap, malah di keterangan alamat tidak ditemukan, g ada wa g ada telpon gda info apa2 padahal nomer sudah tercantum",JNE,Jawa Barat
1,"Paket gua oy , pengantaran dari pagi
Sampe jam 21:28 kaga nyampe juga .
Padahal gua kirim pake kargo itu , sebanyak apa sih isi mobil , hetdah .",JNE,Jawa Barat
1,"Coba besok lagi kalo rekrut karyawan dicek matanya dulu, kurirnya pada buta ga. Paket alamatnya jelas bisa salah kirim. Eh ga tau juga beneran salah kirim apa ditilep kurirnya",JNE,Jawa Barat
1,"Paket ngga dianter2 alasannya penerima tidk ada ditempat,,
Padahl 24jam stay dirumah emang dasar belum dianter ajah bikin alesannya mengada2 …",JNE,Jawa Barat
1,Kurir nunda pket seenaknya pengiriman jam 2 tau2 gajdi ngirim dengan alasan penerima ga ditempat padahal ga ngehubungi sma skli.... Truss udh ngirim dri pagi... Ngubungin jam 12 smpee sore blm di kirim2 juga parahhh bangett sihhh ini mah,JNE,Jawa Barat
1,"Kurir gk jelas, lama, udah di kirim alamat full sama foto masih gk tau, paket sampe 2 hari batal di kirim trus",JNE,Jawa Barat
1,minusss 100000 buat jne parah jelek banget pengirimnya lambat. dikirim barang ngasal disimpennya udah sejam nyari2 paket tapi ga nemu dimana disimpennya. padahal alamat detail udh jelas disimpen di rumah orang mulu. fungsinya alamat buat ditaruh didepan rumah labgsung bukan dititip2. PARAH JELEK BANGET,JNE,Jawa Barat
1,"Aturan paket sampe tgl 14 kemaren ,tp ada keterangan alamat tidak lengkap!! Pdhl dr ekspedisi lain nyampe semua ! DAN d tunggu sampe mlm ini tgl 15 belum sampe juga! WOYYYYYY barang mau d pake nihhh !!! Pdhl ana nmr tlpn tp ga d hubungi sma skli !!!!!!",JNE,Jawa Barat
1,"3x jne cargo ini jelek banget, paket ditunda dengan alasan penerima tidak ada ditempatlah, alamat tidak lengkaplah. Padahal dipaketnya udah ada kontak biar bisa dihubungi, kenapa ga hubungi si penerima paket si? Padahal alamat lengkap seperti biasa kalo kirim paket",JNE,Jawa Barat
1,"I said sorry,, JNE Galuh Mas ini JEEELLEEEKK BANGETTT BANGETTT BANGETTT, saya pikir hanya saya saja yang merasakan tapi ternyata pengguna lain seteluk jambe dan sekitarnya, pelayanannya buruk bangeett, ternyata banyak paket yang tidak …",JNE,Jawa Barat
1,"JNE taii kurir goblog udah 2 hari pesanan gua ketunda, alasan penerima tidak ada dirumah atau alasan alamat tidak lengkap. Najisssss banget padahal gua dirumah terus. Ekspedisi JNE BURUKK ! 👎 …",JNE,Jawa Barat
1,"Busuk, paketnya lamaaa, dah nyampe gudang aja mau diambil masih suruh nunggu lagi, mana lama lagi, gamau nyariin 😑 …",JNE,Jawa Barat
1,"JNE karawang buruk, JNE dikota orang mah mulus mulus aja. ini sumpah buruk bangettt. pengiriman lelet, gaada rating yang paling rendah gitu?",JNE,Jawa Barat
1,"Jelek banget jne galuhmas, padahal keterangan alamat sudah lengkap dan sering ada paket masuk. Tapi alasannya kurir tidak dapat menemukan alamat.",JNE,Jawa Barat
1,JNE ada apa yaa  .?? Paket saya sudah 2 hari pengiriman gagal terus?? Kalo tidak tahu alamat kenapa gak hubungi nomor yang tertera??,JNE,Jawa Barat
1,"Lagi dan lagi barang selalu lelet dikirim nya dulu beli sepeda anak nyangkut berhari² di jne galuh berujung ngambil sendiri ke gudangnya, dan disana juga pelayanan nya lama bgt antri berjam jam....sekarang juga masih sama aja ga ada satset nya dr kemarin status nya sortir trs kaga ada kemajuan parah bgt sih ini",JNE,Jawa Barat
1,Setiap beli online jasa kirim nya JNE karawang pasti ngaret nyampe satu minggu parah gada tanggung jawab nya emang,JNE,Jawa Barat
1,"Alasan alamat tidak lengkap,, udah 3 hari paket diproses pengiriman ulang terus, nelfon ke gudangnya minta nomer kurirnya biar saya bisa hubungi langsung ehh bilangnya ga boleh memberi nomer kurir ke customer,, terus harus gimana,,paket …",JNE,Jawa Barat
1,"Pake JNE YES karena butuh banget paket nyampe besoknya, eh sampe malem ga ada. Saya malah tidur sampe jam 12 malam, di sistem jam 10 katanya penerima tidak ada di alamat. …",JNE,Jawa Barat
2,"Keterangan nya jam 12:21 di kirim ke rumah tapi udah jam 17:28 masih belum sampe juga paket nya, masyallah ngga tau kemna tuh paket nya",JNE,Jawa Barat
1,Paket saya kemana ya udah tiga hari ketahan belum juga datang bilang nya alamat tidak ditemukan kan tinggal whats up itu no nya ada di paket gimana nih jne,JNE,Jawa Barat
1,"bkin customer rugi
Pengiriman lamaaaaa bgt, pelayana kureeng. Ekspedisi bikin kapoooooookk!!!!!!!!!!!!!! …",JNE,Jawa Barat
1,"Kirim paket makanan 7kg ongkir sampe 128rb tapi paket kagak dikirim malah suruh ambil di gudang. Katanya udah ke lokasi tapi kagak ada yg kenal, yang bener aje, tapi oke masih sabar dan toleransi walaupun dah gedek bgt. Pas ditlpn ke kurir …",JNE,Jawa Barat
1,"Status paket di terima yg bersangkutan,trs bukti poto rumah org lain,kocak ini kurir ngirim ke rumah sapa woi.tolonglah di seleksi kurir nya",JNE,Jawa Barat
1,"Ambil paket sendiri 2 kali di tolak alesan pertama : Sudah tutup
Alasan kedua:  Sedang istirahat
Alasan ketiga (pakai gojek) : gak ada alasan (gak bisa di ambil) …",JNE,Jawa Barat
1,jelek amayy pengirimannya kagak di kirim ampe di balikin lagi ke seller pantes ra payu wkwkwk,JNE,Jawa Barat
1,Tlg seller lebih peduli customer. Jgn pake jne buat ngirim barang gede. Ga nyampe brgnya pdhl udh bayar full,JNE,Jawa Barat
1,"Resi kargo, 5 hari sudah status di galuhmas karawang, tapi ga ada info pengiriman konfirmasi apapun ke penerima paket, tiba2 status pengiriman di kembalikan ke pengirim. Go8log emang kurir nya, jaman udah canggih bisa whatsapp atau telepon loh modal dikit napa buat buka aplikasi wa.",JNE,Jawa Barat
1,"Kacau, kurirnya tolong telpon/watsap/telepati/sms dulu kek ke penerima, maen langsung penerima gajelas...dihubungi aja enggak..tolong di review kinerjanya lagi kl mau tetep exist!!!",JNE,Jawa Barat
1,"Jir lah sial gue udah habis setaun ini mah paket gw pake nyangkut di sini lagih, untuk yang kesekian kalinya 😥 …",JNE,Jawa Barat
1,"Kga dntaaa di gudang, semena menaa ngirimnya. Minta yes biar sehari smpe karna barang urgent dan rawan malah udh lewat sehari hari belommm dteng datenggggggg tai",JNE,Jawa Barat
1,"Pelayanan untuk pengambilan paketnya dipersulit pake acara syarat dan ketentuan berlaku ama bagian admin nya lelet gagesit, lambat, , ruang tunggu nya sempit,  panas ga dikasih AC atau kipas pelayanan nya sangat buruk banget mengecewakan …",JNE,Jawa Barat
1,"Paket lama ,kurir ga jelas banget pertama alesan alamat ya lengkap di kasih sharelok tapi paket belom di kirim juga di telpon ga di angkat di wa ga di bales sangat buruk pelayanan nya JNE Galuh mas Karawang!",JNE,Jawa Barat
1,"orang lain pada antri ambil paket, ni satpam malah pilih kasih. ada cewe dandan cantik baru datang mau ambil paket langsung diambilin paketnya ga pake antri tinggal duduk manis, sy tanya alesannya paketnya reguler. lah saya juga paket …",JNE,Jawa Barat
1,"gw ga kenal ama lu abang kurir ah elah kalo alamat galengkap WA ajah chat jangan tiba"" tlpn gmana mau angkat orng tiba"" banget dan gatau nomer siapa gada keteranganya, chat kek nanya alamat patokan gtu..... tambahan lagi kurir"" lain kalo …",JNE,Jawa Barat
1,"Kurir nunda paket se enak nya mereka, udah dua hari paket di tunda alasan alamat tidak lengkap padahal alamat sudah lengkap dan selama ini pesan juga pakai alamat itu. …",JNE,Jawa Barat
1,"Jangan mau pke JNE paket saya aja sampai sekarang belum datang,,,,dri pihak JNE GK ada omongan nya,,,di tlpn sama di wa GK ada jawaban",JNE,Jawa Barat
1,"Sudah puluhan kali saya ngambil paket secara mandiri di berbagai jasa pengiriman yang pernah saya gunalan seperti sicepat, jnt dll, dan di berbagai tempat solo, jogja, surabaya. Dan di jne karawang merupakan pengalaman terburuk, menunggu …",JNE,Jawa Barat
1,"Buruk paket ditumpuk ga dikirim2/ Molor/ tidak update, terutama kargo...",JNE,Jawa Barat
1,"Update Status Sudah du Terima 2 hari lalu, tapi sampe 3 lebih paket tidak di kirim juga. JNE Kurir Manipulasi Data",JNE,Jawa Barat
1,"Paket lama datang, alasan alamat tidak lengkap, sedangkan dipaket tertera nomor saya, tapi gaada menghubungi sama sekali,
Di samperin ke lokasi tapi paket ada di kurir, …",JNE,Jawa Barat
1,"Paket track order pagi dikurir, sampe sore dari kurir belum ada yg konfirmasi. Bad bgt gaada satset satsetnya.",JNE,Jawa Barat
1,"paket stuck disini hampir 1 minggu, saya datangi langsung ke gudang ternyata banyak yang mengalami kejadian serupa. gaada perbaikan sistem kah?",JNE,Jawa Barat
1,Kacau paket katanya alamat tidak lengkap wkwk. Sering mesen pake shopee. Mereka pada tau ko dan Uda sering. Kecewa sama JNE GALUH MAS.,JNE,Jawa Barat
3,"Paket gw mana woy gak nyampe² mana barang mahal, tolong yg amanah dong kurir!!",JNE,Jawa Barat
1,"Woy paket gua statusnya udah di terima, lah siapa yang nerima.. gua blm nerima, org rumah jg ga nerima tuh paket.🤬 jne galuh mas sangat jelekk …",JNE,Jawa Barat
1,kenapa sy kasi rating bintang 1 krn cara kerja kurir tdk benar ..paket buku utk kuliah dilepar sana lempar sini sd 3 irg ganti tp paket tdk kunjung datang kinerja jne sangat buruk  sy selaku org tua kecewa dgn pelayanan tsb sangat …,JNE,Jawa Barat
1,Ko bisa ya kurir tidak amanah masih kerja. Udah jelas alamat' dengan alasan salah kirim. Kalau gk datang langsung ke kantornya mungkin udah bay-bay itu pesanan. Tolong dong yang amanah kerjanya bang kurir,JNE,Jawa Barat
1,pesan satu hari kerja paketnya di butuhkan bgt malah nyangkut di sini ( sortir karawang JNE YES ) masih belum ada perkembangan sampe skg gk bisa di andalkan expedisi ini mah.,JNE,Jawa Barat
1,"Pelayanan buruk, mau ambil paket malah dibentak2. Sudah berhari-hari paket belum dianterin juga",JNE,Jawa Barat
5,"Saya tiap ada paket khusus dateng kesini buat diambil. Pelayanan nya cukup bagus, hanya saja untuk ambil paket perlu waktu lama, wajar karna banyak paket yang harus disortir. Tapi karyawan nya tetep profesional, paket dicari terus sampe ketemu. Sukses terus untuk JNE. Terima kasih.",JNE,Jawa Barat
1,"Pengirim nya buruk sekali lama udah 3 hari belum d kirim juga barang nya.
Sangat tidak rekomendasi banget kurir yang 1 ini",JNE,Jawa Barat
1,Mau diambil sendiri paket malah berbelit² giliran ditunggu² pun lama sampai nya,JNE,Jawa Barat
1,"JNE terparah sih ini , keterangan pkt uda sampai , tp brang belum di terima customer 😡🤬 …",JNE,Jawa Barat
1,"Biasa beli snack aman2 aja, ini mah sampe dimakan rayap. Mana itu snack harganya mahal. Jelek banget kualitas jasanya",JNE,Jawa Barat
1,"NAJIS ALAMAT TIDAK LENGKAP MATA LU BULONG ANJ, LU KALI MALES NYARI ALAMAT JELAS BGT ALAMAT LENGKAP ADA NO HP PENERIMA USAHA LU BUAT TLPN, BISA BISANYA LU GA TLPN, DAN KAIH KET KLO ALAMAT TU GA LENGKAP",JNE,Jawa Barat
1,"Ekpedisi TAI... Kurir nya goblok semua... Paket ga di kirim-kirim..  Di telpon susah,, mau di ambil ribet.",JNE,Jawa Barat
1,"Hari ini Selasa tgl 2 juli 2024
bl*k kali kurirnya, dari sore saya tunggu paketnya di rumah, sekarang jam 20.47 malah di kembalikan ke gudang dengan alasan alamat tidak lengkap, benar2 rusak kinerjanya 🤦🏻‍♂️ …",JNE,Jawa Barat
5,"ASALAMUALAIKUM KAK MOHON MAAF,KERJA NYA SEGERA DI PERBAIKI LAGI🙏PAKET SAYA SEDANG DI ANTAR KURIR TAPI TIDAK KUNJUNG SAMPAI,TRS ALASAN ALANAT TIDAK LENGKAP,KURANG LENGKAP BAGAIMANA?MOHON SEGERA DI PERBAIKI KARNA KORBAN NYA BUKAN HANYA SAYA,OKE SYA SKRG KASIH BINTANG 5 TAPI SEGERA ANTAR PAKET NYA🙏TERINAKASIH …",JNE,Jawa Barat
1,tolong ini jne galuh mas karawang kirain saya doang yang mengalami ternyata sama semua. …,JNE,Jawa Barat
1,"Eh lah dalah, kiriman dibiarin aja dah sampai digudang 3 hari. Mo ambil kiriman antrinya kaya gini. Manajemen JNE kok diem aja pelanggan nya di giniin.",JNE,Jawa Barat
1,pelayanan jelek mau ambil barang di persulit gara2 kurir ga amanah,JNE,Jawa Barat
1,Udah gedek dari dulu tiap liat status paket kalau udah nyampe Karawang pasti ber hari² padahal cuma 5 menit ke tempat saya,JNE,Jawa Barat
1,"Pelayanan buruk banget. 2x kesini buat ngambil paket ga ketemu2, petugas yg di bagian pengambilan sempat kabur. Disuruh ngambil sendiri pun ga ketemu karena paket ditumpuk gitu aja, nanya ke kurirnya pun gatau paket yg reguler ditaro …",JNE,Jawa Barat
1,"paket saya nyasar gatau kemana, gada tanggung jawab, yg harusnya 2hari sampe dah 2minggu nyasar di kirim ntah kemana",JNE,Jawa Barat
1,"Mana woy paket gw, profesional kek kerja, gajelas, tinggal hubungi gw apa susah nya sih sudah jelas terpampang ada nomor gw, gedeg bet gw",JNE,Jawa Barat
1,"Oh pantes banyak yg ngeluh, ternyata begini pelayanannya
JNE yes dari pagi gk sampe sampe.
Bodoh sekali, kacau",JNE,Jawa Barat
1,Jangan pakai jasa JNE dah..nanti nyesel...lelet bgt pengirimannya,JNE,Jawa Barat
1,"Masa alamat ga ditemukan, saya member platinum di tokped gimana caranya saya belanja kalo alamat ga ditemukan? Kalo kurang kurir, karyakan orang baru lah, gudang aja gede tapi karyawannya dikit. Kalo ga niat jd ekspedisi tutup aja, ekspedisi yg lain siap gantiin kok..",JNE,Jawa Barat
5,Kali ini pengirimannya cepet. Ga nyangka paket saya diterima sebelum estimasi tiba. Semoga kedepannya bisa lebih baik lagi dan tidak ada kendala terkait pengantaran paketnya,JNE,Jawa Barat
1,"Pada kagak niat kerja ini ekspedisi,buat apa ada pelayanan YES,kalau paket 4 hari belum sampe juga...
Makin Bobrok JNE !! …",JNE,Jawa Barat
1,"Ekspedisi paling recomended pokoknya.

Recomen buat yg mau paketnya telat sih... …",JNE,Jawa Barat
1,"Gak profesional bgtt!!!! Paket saya digelapin diambil sama ekspedisi nya atau kurir nya!!! Mana bayarypake sopay lagi, gakkkk akan Sudi saya smoga ekspedisi nya gakkk berkahhhhhh sering gelapin paket oraggg",JNE,Jawa Barat
1,"lihat di status ""paket sudah diterima"" tapi foto bukti pengiriman masih di gudang. dan barang blm nyampe,
emg tolol banget ini kurir",JNE,Jawa Barat
1,Parah banget barang numpuk udh 12 hari kita dtng mau cari barang malah suruh cari sndri,JNE,Jawa Barat
1,"Nganter paket gapernah sesuai estimasi meleset jauh mulu
Gausah kerja tolol kalo ga niat",JNE,Jawa Barat
1,ekspedisi terjelek. jelek. sengaja pake yes biar cepet sampai. taunya ttep aja 3 hari dr jkt - krw goblok🤣🤣 …,JNE,Jawa Barat
1,"sampe krw hari kamis, skrg udh Minggu masih jg ga nyampe
di tokped tulisannya tidak ada org dirumah, alamat gak komplit, padahal kurir dateng kerumah aja ga ada 1pun …",JNE,Jawa Barat
1,"Pelayanan sangat buruk ,satpamnya juga sangan buruk 0 attitude kok masih ada yang mau menerima pegawai2 seperti ini",JNE,Jawa Barat
1,"Pelayanan yang baik sekali, mengajarkan saya untuk bersabar dan bersosialisasi sembari menunggu pengambilan paket yang 2 jam belum dipanggil-panggil",JNE,Jawa Barat
1,"Paket saya tolong anterin sekarang.
Saya sudah mahal bayar paket.",JNE,Jawa Barat
1,pengiriman gagal mulu dengan alasan pemilik tidak ada dirumah/nama tidak dikenal,JNE,Jawa Barat
1,"Pelayanan jen paling buruk sejauh ini, ambil paket sendiri aja lama banget butuh berjam jam buat nunggu, sangan slow respon",JNE,Jawa Barat
1,2x kirim barang lwt JNE molor muluu.. males pakai jasa pengiriminan ini.,JNE,Jawa Barat
1,"Pelayanannya kurang optimal, mesen pakai YES sampai nya 2 hari, hadeuh KORUPSI waktu sekali kaliann",JNE,Jawa Barat
1,"lelet lambat,gak becus cuma ngirim paket doang, bubar aja skalian!!",JNE,Jawa Barat
1,"Paket saya pengiriman dr tgl 25 estimasi tgl 30 sampai tp skrg blm saya terima. Malah di resi tertulis kemungkinan barang hilang. Trus gmn..ada ganti rugi ga ke saya, cs ngehubungi cm nanyain paket dh sampai apa belum ga ada jalan keluar. Parahhh bgt.",JNE,Jawa Barat
1,Saya bayar lebih buat Next day karena barangnya ditunggu mau dipake. Tapi nyatanya 3hari masih belum nyampe rumah. Teu barokah usaha maneh JNE !,JNE,Jawa Barat
1,"Kirim dg YES (Yakin Esok Sampai) dari jakarta ke Karawang, kirim tgl 18 sampai tgl 20 ga sampai. Klaim pengembalian uang kata nya sesuai estimasi tiba kota tujuan BUKAN DITERIMA SAYA! yg penting sampai kota tujuan, mo dikirim kurir satu …",JNE,Jawa Barat
1,"Dari sekian byk ekspedisi JNE paling jelek!, pengiriman lama, ditunda2, ditingkatkan lah pelayanannya!!",JNE,Jawa Barat
1,Alamat sudah lengkap dan tertera paket tak kunjung ke terima.d tracking lagi di kirim kurir ke rumah tapi gk sampe sampe dah mau 4 hari.udah yg ke 3 kali harus ambil paket ke gudang dan harus antri kadang di persulit gk boleh nyari sndiri. D cari in juga kaga.,JNE,Jawa Barat
1,Paket ku mana anjir barang gede juga dikirim ke alamat orang ga amanah bgt,JNE,Jawa Barat
1,"TOLONG JANGAN SUKA CLAIM PAKET SUDAH SAMPAI KE PENERIMA TANPA KONFIRMASI KE PENERIMA. Sering banget beli online terutama dari Tokopedia, paket belum sampe tapi diclaim sudah keterima dan TANPA ADA KONFIRMASI ke penerima paket. padahal kurir bisa Wa dulu dan kita pasti ngertiin. Yang lebih parah suka nama penerima dan foto di tipu-tipu",JNE,Jawa Barat
1,"ijin ngasih bintang 1 soalnya udah dua hari ini paket sedang menuju ke alamat tapi malah ngga nyampe nyampe , kalo kaya gini harus di pertanyakan ngga pelayanannya ? berarti ada yang salah , saya tau pihak kalian pasti akan menjawab ""kan …",JNE,Jawa Barat
1,"Gk lagi-lagi pake ekspedisi JNE, paket belum sampe tapi status sudah diterima. Tolong kalo semisalkan nganternya ke maleman atau harus ambil ke gudang hubungin aja nomor yg ada dipaketnya, sengaja pake yang Yes supaya cepet taunya sama aja kaya yg biasa.",JNE,Jawa Barat
1,"Cek di sistem barang hrsnya sy terima tgl 15 maret ,tp ga datang2.
Tgl 17 ke gudang jne galuh,ternyata barang  sdh ada 1 dus,1 dus lg blm ada,bilang sdh cek sistem 1 dus lg  di jakartalah... …",JNE,Jawa Barat
1,"udah nggak puas pelayanan yang disini .. mending ke otlet jne nya aja...

kerja nya lambat",JNE,Jawa Barat
1,"Tutup aja lah expedisinya udah ga amanah, status paket udah diterimaaa tapiii ga ada bukti fotonyaa... padahal barangnya aja belum saya terimaa woyy..  seenggaknya tuh telfon kek kalau ga tau alamat rumah. Bukan kaya gitu caranya main udah delivery",JNE,Jawa Barat
1,"parah bgt pokoknya, udh 2 kali bolak balik ambil paket gabisa alesannya ini lah itu lah, tapi ga dianter anterin. Udah 4 hari paket disitu ga gerak sama sekali. Diambil susah dianterin enggak. Enak bgt disuruh bolak balik pdhl rumah ke sini 40mnt an.",JNE,Jawa Barat
1,"Kalo bisa pengen aku kasih bintang minus 100😭 setiap pengiriman pake JNE, kalo ga lambat banget, ya paketnya ga nyampe-nyampe. Udh dikasih serlok berkali-kali, tetep aja lama bgt nyampenya. Hari ini dikasih serlok, kirain bakal nyampe hari …",JNE,Jawa Barat
1,"mau ambil sendiri antrian nya bikin istighfar.. pelayanan nya lambat, admin nya cuma 1.. tempat tunggu nya Maasya Allah gak nyaman.. tolong d perbaiki ya..",JNE,Jawa Barat
1,"Pengantaran paket lambat kadang gk di antar ke alamat yg tertera buat apa harus nyantumin no hp
kalo ngambil ke gudang suka lama parah",JNE,Jawa Barat
1,"Paket gw udah 5 hari sejak tiba di Karawang masih aja ngga nyampe, akhirnya gw ajukan pembatalan aja.. pake jasa kirim yg lain 1 hari tiba di Karawang udah langsung sampe rumah, JNE Galuh mas ini kenapa lama sekali, keburu pada mati tuh …",JNE,Jawa Barat
1,"apaan sih nih ekspedisi, 3 kali statusnya pengiriman gagal tiba-tiba statusnya udah diterima, nyampe ke rumah aja kaga, fotonya entah dimana tuh barang, sumpah nih pada ga niat kerja, barang pernah kekirim aja dibuat jadi kekirim, anehhhhhh",JNE,Jawa Barat
