Rating,Reviews,Company,Province
1,"Ekspedisi parah, datang mau ambil paket disambut dengan muka jutek dan sibuk main HP, dibiarin nungguin paket diambil digudang sampai lama, klo gak ditanya gak dicek. Padahal saya yg datang ambil sendiri, barang sudah sampai di Manokwari …",JNT,Papua Barat
1,"Kurir ini  selalu putar"" saya dia bilang ketemu di Kodam,setelah saya di Kodam dan ketemu dengan kurir ini..stelah itu dia dengan alasan lupa paketnya jdi pengiriman batal 2 kali...",JNT,Papua Barat
1,"Sangat"" buruk tidak becus kerja, paket sy sudh sampai tapi udh 4 hari sy g bisa ambil paket sy kalau kaya gini merugikan orang, mending tutup saja sudah & sy sudh ngumpulin semua bukti dan akan melaporkan ini k J&T pusat culup sy sabar ini bukan kali pertama nemu pekerja g becus kaya gini trmasuk kurir juga yg g niat antar paket",JNT,Papua Barat
1,Kurinya banyak putar putar kalau gak niat kerja gk usah masa paket kita di kembalikan. Dan sifat kurirnya tdk sopan di tanya banyak marah dan tdk pernah bals dengan cepat tp kalau kita bls lama dia marah marah,JNT,Papua Barat
1,"Barang sdh dtg dr 2 hari yg lalu tp tdk di antarkan, pelayanan terparah dari j&t👎👎👎
Alasan tra bs antar krn sdh di luar ktr. …",JNT,Papua Barat
1,"Sangat menyesal pake j&t,cukup ini saja",JNT,Papua Barat
1,"Hilangkan saja J&T yg di papua, kalo misal tidak ada yg bisa antar di tempat2 tertentu, tidak usah jual jasa. Barang su sampai, alasan ""tidak ada pengantaran ke sana"",,, bikin sa pu  kredibilitas akun jadi rusak saja.",JNT,Papua Barat
1,Pelayanan buruk Skali kah klo tra niat buka jasa antar barang tu tutup saja sudah Jan cuman maunya makan gaji buta saja,JNT,Papua Barat
1,"Wkwk gila sih ekspedisi paling payah d mkw. Kalau bkn karena skrg tdk bsa memilih ekspedisi d platform olshop, gak ad yg mau pkai jnt. Kurirnya sok ngartis, dichat gak bales tp gak mau nganter juga. Tp gliran udh batas penyimpanan, baru dah …",JNT,Papua Barat
1,"Pelayanan sangat buruk, konsumen harus datang ke gudang, barulah barang dicari. Para karyawan seakan tidak niat kerja, pakai layanan/jasa antar lain saja",JNT,Papua Barat
1,"Masah kita yg pesan kita juga yg ambil, trs di mana kurirnya kalau tdk mau antar tidak usah pakai kurir",JNT,Papua Barat
1,"Karyawannya pemalas semua
Gk niat kerja
Masa sya ambil paket lamanyaaa …",JNT,Papua Barat
1,"KALAU G NIAT BUKA CABANG MENDING G USAH SOK JALANIN, TUTUP MENDING!!! DI TRACKING PAKET SAYA TIBA DARI TGL 31 MEI n 6 JUNI, SAMPAI SEKARANG KOK TDK ADA PETUNJUK ATAU KABAR!! MODEL KAM INI YANG RUSAK ORG PU NAMA PERUSAHAAN",JNT,Papua Barat
1,Orang orang J&T ini memang tidak niat kerja. Paket dari tanggal 29 Maret tiba di mkw tapi tidak juga diantar sampai hari ini. Kalo malas kerja mending bubar sudah.,JNT,Papua Barat
1,Kenapa lemot banget ya jnt mkw ini barang sampai satu minggu kemudian baru diantar kadang lama sekali ga ngerti lagi gmn,JNT,Papua Barat
1,"Jangan selalu seperti ini, iya saya butuh kalian tapi saya juga bayar, sudah banyak komplain tapi sama sekali tidak ada perubahan.",JNT,Papua Barat
1,"Tolong jasa pengiriman ini J&T ini di tutup karena meresahkan banyak pelagang jasa ekspedisi, dari nanti kami bertindak lebih anarkis,,.. dengan si jago merah ,Mohon di tanggapi dengan serius...
Dalam satu bulan ini kita ksh waktu!!!",JNT,Papua Barat
1,"Kecewa dengan layanan J&T Cabang Wosi Manokwari. Tadi ke kantor J&T katanya barangnya sudah dikirm kembali.. Padahal status di aplikasi Trace & Track J&T masih ""On Hold"" ...",JNT,Papua Barat
1,Pelayanan amat sangat buruk sekali..... Sdh mahal lama sekali diantar... Terpaksa ambil sendiri... Tra jelas skali,JNT,Papua Barat
1,"Paket datang tgl 2 sampai tgl 6 gak d kirim kirim,cm sttsnya  sj d perbarui slalu d tarih d gudang bgtu melulu🤦‍♂️🤦‍♂️ …",JNT,Papua Barat
1,Paket saya sdh tiba di mkw tgl 7 sept tapi sampai hari ini tdk di antar. Tdk tau kurirnya bikin apa sampe pamalas antar. Sy sdh hubungi salah satu kurir tp tidak di respon dgn maksud kalo mmg tdk mau di antar biar sy yg ambil jd kurir tdk …,JNT,Papua Barat
1,"Kerja tidak profesional, pengiriman tidak sesuai estimasi di Aplikasi, bahkan molor sampai lebih dr seminggu barang belum dikirim. Mending tutup saja kalau nggak mampu, dr pada buat kecewa pelanggan.",JNT,Papua Barat
1,"Jasa pengiriman sangat buruk, saya sudah berulang kali kirim paket di J&T stiap sdh sampai di Gudang Logistik mkw saat mau diambil alasan nya masih baru datang jadi belum di sortir, kemudian sy disuruh dtang besok pagi nya, waktu besok pagi …",JNT,Papua Barat
1,"CS tolonglah profesional untuk, setidaknya pelayanan diperbaiki, user janganlah di cuekin sambil main hp di meja CS, kalau memang harus menunggu sedikit lama info atau estimasi jangan dibiarkan aja user.",JNT,Papua Barat
1,Mending pilih jasa layanan lain aja. Pelayanan sangat tidak bagus,JNT,Papua Barat
1,"Kerja sangat tidak profesional sekali, pengiriman tidak sesuai estimasi di Aplikasi, bahkan molor sampai lebih dari seminggu barang belum dikirim. Kalo bisa di tutup saja kantor J&T Manokwari",JNT,Papua Barat
1,Sangat mengecewakan. Biaya pengiriman ke wasior tapi hanya sampai ke manokwari. Karyawan j&t manokwaripun macam buta tidak bisa lihat nomor hp kita untuk dihubungi dan dikabari bahwa barang kita ada di mereka. Eh malah dikirim balik ke …,JNT,Papua Barat
1,J&T di manokwari pelayanan sangat jelek barang saya di kembalikan lagi ke surabaya. Sampai”  toko tempat saya pesan barang tidak mau kembalikan uang saya,JNT,Papua Barat
1,"Semua komentar ngeri, tolonglah JnT perbaiki kinerja, 😂, lau lau se, nnti kantor dapa bakar baru …",JNT,Papua Barat
4,segini dulu. nnti kalau paketku dah sampai bisa naik bintangnya,JNT,Papua Barat
1,BARANG SU SAMPE TP TDK DIKIRIM DI AMBIL LANGSUNG ALASAN BARANG BLUM DI BONGKAR KURIR. KLO TRA NIAT KER4JA TUTUP SA!!! PARAH INI PELAYANNYA!!!,JNT,Papua Barat
1,Mending jasa pengiriman JNT ini di bubarkan saja.. pelayanan semuanya tidak sesuai prosedur..,JNT,Papua Barat
1,Sebaiknya Kantor J&T Manokwari ditutup aja pelayanan tidak becus dan merugikan. Manager J&T jangan tinggal diam aja.,JNT,Papua Barat
1,"Namanya sj express, tpi lambat mcm siput, ekspedisi ele elean gaada pertanggung jawabannya",JNT,Papua Barat
1,"buruknya J&T Manokwari
1. ketika paket datang, tidak ada pemberitahuan SMS/WA kalau paket telah sampai di mkw …",JNT,Papua Barat
1,Tdk ada konfirmasi sama sekali barang sy langsung di kembalikan. Pelayanannya bagaimna sih kurir J&T,JNT,Papua Barat
1,Sangat parah paket sudah hampir 1 minggu dari tanggal 13 di kota sampe sekarang tanggal 18 belum juga di kirim,JNT,Papua Barat
1,"Wah disni ulasannya smua parah sx, brrti sa turun baru dpt pelayanan tdk bgus, di cuekin nnti liat saja, sa maki dlm muka. Tp klo di layani bagus² brrti  sopan",JNT,Papua Barat
1,Sumpah jasa pengiriman ini nggak sama kaya JNE yang hari Minggu masih ada pelayanan pengambilan pake walaupun di kantor,JNT,Papua Barat
1,"Saya kira ada cabangnya di ransiki kab,manokwari selatan, ternyata tidak ada. Sudah bayar full ongkir 650k dri jwa barat ke ransiki, tidk taunya harus ambil juga ke manokwari. Udah gitu slow respon, pelayanan di tmpt juga tidk memuaskan",JNT,Papua Barat
1,Paket dari 14 maret smpe skrg tdk di antar.. Tidak di hubungi juga.. Aneh,JNT,Papua Barat
2,"Mohon maaf untuk pihak JNt, knp paket saya sampai skrg blm ada kabar, sdgkan pengiriman dari kota palu dari tgl 28 Agustus.. sampai saat ini tdk ada kabar padahal katanya barang SDH tiba di manokwari",JNT,Papua Barat
5,"Sesuai pengalaman sy pribadi, di Manokwari hanya JnT saja yg ada layanan bayar di tempat penerima barang. Jadi kalau ada komplain di marketplace misalnya barang elektronik harus direturn ke penjualnya, maka lewat JnT barang elektronik yg …",JNT,Papua Barat
1,"Setiap pke ekspedisi ini selalu ambil paket n tdk pernh diantar, parah,,, mlh pada main game. Mantap skli pegawai ny",JNT,Papua Barat
1,"Sedikit lgi nnti tong bongkar Kam PU kantor, babingung nao2, kalo mmg trda niat lebih baik Kam cari kerja lain, tidak becus skali jdi ekspedisi, TDK profesional, pelayanan buruk, pengiriman selalu lewat waktu, ini owner sama menager nya yg …",JNT,Papua Barat
1,"Gimana si buka lapak pengiriman begitu tapi tdk bertanggu jawab untuk layanin tugas antar barang sapai tujuan, percuma",JNT,Papua Barat
1,Pelayanan sangat buruk . Pengiriman status tidak dikirim kirim. Sampai 9 hari bertelur dikantor jnt Manokwari tidak dikirim kirim barang. Sangat buruk,JNT,Papua Barat
1,kacau sekali barang udah sampai pada tanggal 28 sampai tanggal 30 belum dikirim🥱 …,JNT,Papua Barat
1,"paket lama diantar, pelayanan buruk, petugas bermalas malasan",JNT,Papua Barat
1,"Ckup stu kli ini aja krim lwat j&T pngriman nya lambat dan banyak proses nya,,, nyesal sya ngrim lwt j&t,,,",JNT,Papua Barat
1,"Pelayanan yang sngat buruk, masak sy dtng di cuekin karyawanya malah main ml pdhl dah liat sy brdiri dbdepnya serius main game, sngat tdk ramah, jauh² dri andai malah d suru blik ktnya blm d sortir udh 2 kli",JNT,Papua Barat
1,"Dah lah malas kerja  abang2, paket 2 minggu tidak di antar2",JNT,Papua Barat
1,Paket sdh tiba di mkw eh di antar 1 minggu kemudiann tolol,JNT,Papua Barat
1,Paket g mau d antar ke lokasi,JNT,Papua Barat
1,"Ini mending tutup expedisiya,paket sdh 2minggu gak dikirim kirim",JNT,Papua Barat
1,"Pelayanan pegawainya sangat lambat,tidak profesional dalam melayani",JNT,Papua Barat
5,Kk jam 11 sa balik kesitu . tolong sertakan no hp biar kita bisa hubungi.,JNT,Papua Barat
1,Pengiriman lelet. Kalo barang dah sampai langsung aja di kirim. Jangan ditunda2 mulu,JNT,Papua Barat
1,Parah paket gak di antar” pelayanan sangat mengecewakan,JNT,Papua Barat
1,Barang selalu tidak sampai,JNT,Papua Barat
1,Barang udah nyampe tapi barang nga dikirim2 jg aneh,JNT,Papua Barat
1,ada yang tau nmr hp kurir atau staf jnt manokwari,JNT,Papua Barat
1,Pelayanan di drop point manokwari Lambat sekali. Mengecewakan.,JNT,Papua Barat
1,Gai ramah barang sampai gk di kasih tau malah sudah mau di retur,JNT,Papua Barat
1,Kam kalo tra niat buat buka usaha jangan buka tutup sj blok,JNT,Papua Barat
1,"Paket aku sampe 2x dikembalikan, terpaksa aku laporkan ekspedisinya kepusat langsung",JNT,Papua Barat
1,"Maaf ya beri bintang 1 aja, pelayanan tidak memuaskan",JNT,Papua Barat
2,"Tolonglah kurirnya di kondisikan, klo aja bisa milih jasa ga lagilagi make j&t!!
Paket sya sering di retur ulng dg alsan tdk bisa di hubungi, toh stiap di cht …",JNT,Papua Barat
1,BARANG 12 HARI NGGAK DIANTAR2. KALAU NGGAK NIAT MENDING DITUTUP AJA,JNT,Papua Barat
1,Sdh jam 10 pagi tpi kntor msih tutup,JNT,Papua Barat
1,Tolong di informasikan bila ada keterlambatan,JNT,Papua Barat
1,Najis pelayanan goblokkkk,JNT,Papua Barat
1,Mbak2nya judes pelayanan gak ramah blas,JNT,Papua Barat
1,Jasa pengiriman barang terburuk,JNT,Papua Barat
1,"baru juga nyampek brg langsung dikrim balik lagi, ini kurir males atau bagaimana?",JNT,Papua Barat
1,pelayanan buruk pol,JNT,Papua Barat
2,Pelayanan kurang baik. Tolong perbaiki pelayananya ...,JNT,Papua Barat
1,Pelayanan terburuk,JNT,Papua Barat
1,Pemalas antar paket,JNT,Papua Barat
1,Pelayanan tdk ramah..,JNT,Papua Barat
1,Ekspedisi paling jelek,JNT,Papua Barat
1,Tidak jelas,JNT,Papua Barat
1,Tidak profesional,JNT,Papua Barat
1,"Pengirimnya bodoh, sumpah gak baik, gak datang, gak ada konfirmasi, aku sms telfonnya pas di angkat, udah lama banget, jadi udah lama banget aku tutup layanan ini .",JNT,Papua Barat
5,Oke,JNT,Papua Barat
1,No review found,JNT,Papua Barat
5,No review found,JNT,Papua Barat
5,No review found,JNT,Papua Barat
5,No review found,JNT,Papua Barat
5,No review found,JNT,Papua Barat
4,No review found,JNT,Papua Barat
1,No review found,JNT,Papua Barat
1,No review found,JNT,Papua Barat
1,No review found,JNT,Papua Barat
1,No review found,JNT,Papua Barat
1,No review found,JNT,Papua Barat
1,No review found,JNT,Papua Barat
1,No review found,JNT,Papua Barat
1,No review found,JNT,Papua Barat
5,No review found,JNT,Papua Barat
1,No review found,JNT,Papua Barat
1,No review found,JNT,Papua Barat
