Rating,Reviews,Company,Province
1,"Untuk kurir pickup harus bener2 kerja jangan males. Pickup sampai 1 minggu gak di ambil2,  Sampai yang penerima datang langsung kerumah .. Klo gak niat tutup saha",JNT,Jawa Timur
1,"karyawan tidak amanah banyak paket hilang dan tidak ada tanggung jawab.
pickup pake aplikasi tidak di pickup"" emang dasar pemalas semua karyawanya.
udah judes, ketus, gak sopan",JNT,Jawa Timur
1,Admin kurang tanggap jika ada resi yg salah tidak segera melakukan konfirmasi kepada yg bersangkutan …,JNT,Jawa Timur
1,"Pengeriman sangat mengecewakan
Kiriman dr tgl 3 sudah dilamongan, sampe skrg gag dkirim2
Alasan tertahan,dtunda,pembeli TDK dapat dihubungi, pembeli TDK dtempat. . …",JNT,Jawa Timur
1,"Layak sekali banyak yang menilai bintang 1. Ternyata memang bener sih. Kurir pick up barang posisi pintu terkunci malah digedor2 sampe anak bayi tidur kaget. Dan masalah administrasi juga ribet. Astagaaaa pdhl biasanya suka sama jnt sekarang ribet banget, perkara pick up barang aja sampe berhari2 urusannya",JNT,Jawa Timur
1,Sudah 2 kali kirim paket prosesnya telat terus gimana jnt jl. Pahlawan ini buat toko saya selalu kenak pinalti,JNT,Jawa Timur
1,"Pertama kali kesana kemaren tanggal 5 juli, saya niatnya mau ngembaliin paket, kata kakaknya disuruh taroh aja nanti diproses tapi sampe sekarang saya cek nomor resinya gaada entah ga diproses atau gimana, saya harap ada kontak dari pihak …",JNT,Jawa Timur
1,"Tolong paket saya kenapa d rescedul terus, padahal saya ngak ngerasa dihubungii, kerja yang bener yang jujur.",JNT,Jawa Timur
1,"Saya di kasih no WA dari admin JNT, tapi Nomer nya tidak merespon dan menolak panggila ‼️‼️‼️‼️ Sangat tidak ramah‼️‼️‼️",JNT,Jawa Timur
1,"Prosesnya lama , nyampek j&t jam 10 pagi jam 15.30 belum di proses parah",JNT,Jawa Timur
1,jne ini mengirim barang tapi malh di suruh bayar asurandi dan barang saya sampai sekarang tidak nyampek,JNT,Jawa Timur
1,Paketku ilang nulis resi gak sesuai alamat pacitan ditules paciran paket dorong teko wes ditules barang diterima pake 11 sg teko mok 5,JNT,Jawa Timur
1,"Paketan yg aku kirim sering hilang dsini dan tdk ada tgg jwb sama sekali... Ceritanya dulu pernah ada paketanku yg hilang, pas ADM mbaknya kerudung yg pendek,itu org waktu itu msh ada tgg jwb.. Habis itu ehhh hilang lagi tp ADM mbak² yg …",JNT,Jawa Timur
1,"Untuk pengiriman sangat buruk, cs menyanggupi kirim ke bengkulu tengah dalam waktu 3 hari sampai 4 hari barang belom sampai ke penerima, sampai penerima datang ke lokasi baru di proses",JNT,Jawa Timur
1,Proses pengiriman tertunda karena alasan tak jelas dan kurir sangat lambat untuk mengirimkan paket ke konsumen,JNT,Jawa Timur
1,Paket udah 5 hari dari tanggal estimasi ngak nyampe juga ekpedisi lelet. Kapok pakain jne,JNT,Jawa Timur
2,bk se x 2 x j&t buruk. knp d kirim k tetangga sdgkn rmh ada org. kl pun g ada org kn bs telp ada no hp sy. selalu meresahkan. ber x x ya mslh dg pngiriman kurir j&t yg very BAD. …,JNT,Jawa Timur
1,"Niat hati paket dateng hari2 jauh sebelum lebaran. Malah paket stuck ditransit sampek 3 hari, J&T beda ama dlu gercep, sekarang lelet +males nganter paketnya jd lama bgt. Saranku stop aja kalian yg pake j&t ganti yg lain aja. Nih ekspedisi lelet disegala hal sekarang",JNT,Jawa Timur
1,"Maksudnya apa ini ReSchedule baru kali ini saya ngalamin kek gitu, Jangan pake kurir jnt ges NYUSAHIN, Kalau yang lain mah cepet lah ini",JNT,Jawa Timur
1,"Paket saya udh seminggu lebih gakk di antar"" Juga. Padahal paketny udah di bayar. Kalau cod mah gak ppa gk di antar... Di shopee jg gk ad update an ny. Gmna ya ini",JNT,Jawa Timur
1,"Sudah dua hari paket saya resinya sdh diterima anggota keluarga,padahal kami belum ada menerima..alamat dan foto dibukti pengiriman bukan di alamat/rumah saya..",JNT,Jawa Timur
1,"Baru kali ini nemu jasa se parah ini barang bukannya di kirim mlh di retur.  Paket datang dari tgl 23 tiba di lamongan    sampai skrg gak ada tlpon atau pemberitahuan tiba"" Barang langsung di retur ngotak dikit lah .aku order paket ini udah …",JNT,Jawa Timur
1,"JnT mohon kurir-kurirnya dikondisikan. Setiap antar barang, barangnya selalu dilempar dari depan pagar. Padahal pagar terbuka, tidak ditutup ya malah terbuka lebar.",JNT,Jawa Timur
1,Gajelas. Bknnya dikirim ke penerima malah disuruh ambil dikantor. Mana bayar bukan make sopi yg gratis ongkir gajelasssssss gabut kerjanya bro,JNT,Jawa Timur
1,Kecewa banget soalnya barang ada yang hilang.....,JNT,Jawa Timur
1,"Baru kali ini nemu kurir yang gak ada sopannya sama sekali gedor rumah sampek terus menerus di jam 12 siang. Anak saya baru tidur sampek kebangun, tolong jaga etika bertamu buat kurir lainnya.",JNT,Jawa Timur
1,"Pengiriman jnt sekarang bener2 sangat buruk dan mengecewakan masak paket 3 hari sudah sampai Lamongan gak di kirim2 percobaan pertama sampai ketiga
Ada nomer kurir tapi ya gitu lah nomer kurirnya gak aktif apa gunanya no …",JNT,Jawa Timur
1,"dibantu untuk meningkatkan pelayanannya nggih mas, banyak paket dari kita yang tercancel otomatis, karena tidak ada yang pick up dari pihak j&t",JNT,Jawa Timur
1,Kurir tidak amanah masa udah di kasih tulisan di rumah paket atas nama ini taro di sini karna orang e kerja eh malah di bawah balik ke kantor di cht suruh bawah pulang saja nnti di ambil kerumah kurir nya btw kurirnya tetangganya sendiri …,JNT,Jawa Timur
1,"Lama banget, paket stuck di drop point lamongan 3hari, td pagi update status gagal kirim pelanggan tidak ada di tempat, sedangkan dirumah ada nenek",JNT,Jawa Timur
1,barang rusak parah ga mungkin hanya jatuh. kayanya habis dilempar atau ngga ditindih barang yang berat. ngga ada ganti rugi,JNT,Jawa Timur
1,jangan pakai J&T lagi!. 3 hari paket saya stuck nggak bergerak sama sekali,JNT,Jawa Timur
1,"Kami senin, 30 maret 2020 jam 16.00 wib kirim 9 paket shopee ke j&t sampai jam 23.11 kok blm ada konfirmasi, bgmn ini?",JNT,Jawa Timur
1,"Kerjanya ngapain aja bang?! Barang udah 3 hari gak gerak disitu gak ada kejelasan. Kalau gak amanah gak usah sok bikin jasa kirim. Sotoy!!!
Paket estimasi sampai tgl 25 okt sampai 28 okt blm sampai. Di hub Lamongan aja terus. Cukkk",JNT,Jawa Timur
5,Luar biasa ekspedisi ter top. Bisa bayar shopeepay.. Dapat cashback pula 🤑🤑 …,JNT,Jawa Timur
1,"sejauh ini, disini pelayanan admin nya paling buruk dibandingkan yang lain, mau ambil barang di drop point, dibilang suruh pulang ditunggu di rumah saja, karyawan kayak gitu kok masih di pekerjakan.",JNT,Jawa Timur
1,"Payah, 2 kali pengiriman nyasar kemana""...
Paket udah status di lamongan malah di kirim ke mantup, padahal tujuan ke karanggeneng.. malah sekarang di kirim ke jakarta lagi... …",JNT,Jawa Timur
1,Paket sdh dr tgl 21  pagi uda di lamongan tp sampai skrg tgl 23 paket gak bergerak...burukkk ini jnt drop points jnt lamongan......,JNT,Jawa Timur
1,"Paket bjn-lmg 6 hari gak bergerak
Emang kalo kantor udah gede pelayanan nya makin buruk …",JNT,Jawa Timur
2,"pernah retur barang, adminnya 2 uda jutek ngomongnya alot banget lagi haha
""mbak mau retur barang"" tapi balik melotot doang gaada yg ngomong apa2 sampe pada akhirnya cuma ngomong ""ditaruh sini aja, resinya uda ditulis ya""
sedih sih",JNT,Jawa Timur
1,"Kurir nggak amanah,,paket Free Ongkir kok masih di tagih biaya ongkir,,masih untung yg terima adik gue, kalau gue yg nerima lu bakalan gue viralin👎🏾 …",JNT,Jawa Timur
1,"Kirim paket celana dari JEMBER KE TUBAN, melalui J&T lamongan. Saya jual celana akan tetapi pembeli menerima skincare. seharusnya resi tertera kode JBR-TBN tapi di cetakan jadi LMG-TBN seperti di tukar paket dan dicetak kembali celana diambil",JNT,Jawa Timur
1,Ambil paket retur di persulit sampai 1 bulan di oper2 ke banyak orang .....Paket returan saya ambil di kantor kata adminya gak tau di mana...saya usut sampai 1 bulan lebih Baru di berikan ...pecat aja tuh admin songongnya,JNT,Jawa Timur
5,"Sip sih,tapi ada sedikit pengalaman kurang menyenangkan dengan kurirnya.
Pas ada pengiriman cod, saya tidak di rumah dan lupa menutipkan uang sama orang rumah. …",JNT,Jawa Timur
1,"paket stuck disitu trus belom nyampe2 pdahal keterngannya di lmongan udah 4hari lebih stuck di situ trus belom di anter2, parahhh",JNT,Jawa Timur
1,Kurir gak tanggung jwb paket ditunggu drmh berhari2 ga ada konfirmasi ga ada chat ga ada telp.. tiba2 paket diretur aja ketahuannya saat lacak paket mba admin nya jg kurang sopan .. 3 paket mbak mas gmn tanggung jwb nya tiba2 paket diretur …,JNT,Jawa Timur
1,Apa memang betul jnt tidak bisa mengirim paket yang berisikan hp? Karena saya ditolak lantaran isi paket yang akan saya kirim berisi hp,JNT,Jawa Timur
1,"Kurir nya kek tai gak ada apa"" kok tiba"" tertunda di reschedul trs cok iya kalo paket isinya barang nggak apa"" serah lu, ini paket isi binatang lu lama""in sampe mati anjeng emang cok",JNT,Jawa Timur
1,Parah ini j&t status uda di lamongan masa balik lagi ke surabaya dana parah nya besok nya ke malang.mla muter2 gak karuan,JNT,Jawa Timur
1,"Pelayaannya gak ramah sama sekali, entah itu kurir atau cs nya, pada songong",JNT,Jawa Timur
1,Pelayanannya sangat buruk . Tiba tiba kurir tanya via WA paketan sudah di terima atau belum . Kenyataannya paket belum dikirim sama sekali . Dan dikonfirmasi lagi paket masih di gudang dan nomer resi hilang sudah nunggu 24 jam lebih paket …,JNT,Jawa Timur
1,"D telp g dangkat"" Beberapa hari paketan ad d lamongan g diantar"" Ke tempat tujuan, pelayanan buruk",JNT,Jawa Timur
1,Padahal paket sudah sampai disini tapi katanya belum sampai. Pas puter balik pulang baru status resinya berubah dan tiba tiba paketnya sudah dibawa kurir otw ke alamatnya. Kita sebagai custumer yg sudah sering pakai jasa JNT pasti sudah …,JNT,Jawa Timur
1,"halo mb admin j&t kalo jadi admin jgn sinis² ya (dua²nya masyaAllah hmm sabar), kalo sekiranya udh tutup mbok ya rolling doornya tuh ditutup separo biar org tau. di google noh baca buka sd jam 17.00 tapi masih jam 16.45 kok mau kirim paket …",JNT,Jawa Timur
1,"Pelayanan buruk sekali, posisi kampung saya banjir nganter sudah didepan kampung tidak telefon malah tidak mau mengantar lagi & barang saya mau diretur. Begini ta jasa pengiriman yang baik!!!",JNT,Jawa Timur
1,"nyesell bangt kirm lewat sini,  sama2 jawa timur kirm kue kering 4 harii blum sampe2,",JNT,Jawa Timur
1,"Admin 2 2 nya sinis bgt !! Dari msih jnt di dekat pasar ikan sampai skrg pindah tempat. Admin nya sumpah sinis bgt gak ramah !! Org org Gini kok dipekerjakan .
Kita ini pakai jasa kalian itu bayar .. …",JNT,Jawa Timur
1,"Maaf bintang 1, paket saya tertahan 2 hari di j&t lamongan, alasan hari pertama karena cuaca buruk, hari kedua alasannya karena saya tidak ditempat, padahal saya di rumah dari pagi tidak ada kurir yang datang, kalau memang paket belum bisa dikirim dimohon jangan memberikan alasan pelanggan tidak di tempat",JNT,Jawa Timur
1,"Pengiriman nya lambat padahal saya Uda langganan, kenapa jadi lelet",JNT,Jawa Timur
1,"Terpaksa harus menuliskan karna tidak ada kotak saran, sudah bilang ke petugasnya nda ada respon. Kami datang jam 16.40 utk antar paketan yg isinya sangat penting tapi ditolak katanya sudah kebanyakan paketan yg masuk jika.kami datang jam …",JNT,Jawa Timur
1,"padahal ada orang dirumah tp gamau ngetuk pintu gegara pas H-1 ada paket yg datang tp ak lagi pergi sebentar, dan paketnya tuh COD trs dibyarin dulu sm tetangga. Dan sesudah kejadian itu ada pakt COD lagi padahal dirumah ada orang tp …",JNT,Jawa Timur
2,"Demi apaa.. kurir pick up nya ga disiplin banget. 😭😭🙏
Pick up barang mesti di wa dulu, padahal udah masuk sistem harusnya otomatis diambil. Di wa pun kadang ga di read dan ga di ambil, kadang ujug2 di depan rumah, …",JNT,Jawa Timur
1,"dari dulu sampe skrg baru kali ini kecewa bgt wkwk. ""mbaknya bohong bgt"" ya, pas sy ke kantor bilang kalo paketnya udh dibawa kurir sedangkan sy cek di aplikasi klo masih belum dibawa. balik dan udah ditungguin lama ga dateng², pas telpon …",JNT,Jawa Timur
1,"Paket saya tujuan Paciran, dan resi berhenti update setelah Sampek j&t pusat Lamongan. Sampai pesanan batal dan entah dimana paketnya Sampek sekarang tidak ada kejelasan. Ditanyakan malah saling lempar kayanya nanti dihandle supervisor, …",JNT,Jawa Timur
1,"Buat apa ada layanan pick up kalo disuruh nganter sendiri ke kantornya, resi sudah dari Selasa katanya nunggu dijemput kurir nyatanya sampe Kamis blm ada yg jemput. Saya marah mah wajar, …",JNT,Jawa Timur
5,"Di shopee seller  ada tombol pickup barang pada pilihan pengiriman, tp sejak hari jumat sampai hari iini minggu, tidak ada yang mengambil paket yang akan saya kirim, kenapa begitu? dan kenapa harus ada tombol pickup kalo gak ada yang mengmbil paket yang akan dikirim",JNT,Jawa Timur
1,"seharusnya ditulis tutup pukul 18.00 bukan 20.00, saya jauh2 datang, posisi hamil kirim paket lebih 30 menit. Malah jadi bahan tertawaan para sprinter. …",JNT,Jawa Timur
1,Kecewa banget bawa barang besar.Tidak bisa kirim karena listrik mati. Apa tidak ada genset atau di terima dulu nanti di proses resi di fotokan. Biasanya kan begitu.,JNT,Jawa Timur
1,"Kali ini kecewa banget sama pelayanan JNT, masa dari Malang ke Lamongan aja 2 hari gk sampai² padahal isinya itu Buah Apel Malang. Beda sama Sicepat Ekspress, beli jam 12 siang, nyampai dirumah jam 9 pagi. Pantas aja Dedi Corbuzier pindah ke Sicepat Ekspress",JNT,Jawa Timur
5,"Pengiriman selalu tepat waktu, dan cepat

Mbak² petugasnya ramah, pas pagi banget (belum buka counter nya) saya taruh …",JNT,Jawa Timur
1,"Tolong segera diperbaiki untuk layanan expedisi pengiriman. Mohon sangat untuk lebih bijak karena barang yg wajib dikirim malah netap digudang aja gimana mau bergerak datang ke alamat tujuan nya udah lama gak Dateng"" paketnya sangat kecewa baru pertama ini layanan expedisi J&T LAMONGAN jelek parah si",JNT,Jawa Timur
1,Pelayanan buruk sekali. Kiriman paket lewat aplikasi tidak di jemput di rumah.di antar ketempat lokasi jnt malah gk di input2 no resinya.pelanggan sudah marah2 tapi pihak jnt tidak memberi solusi paket yg sudah di terima.,JNT,Jawa Timur
1,"j&t lamongan sngattt tidak rekomend. paket sttusnya sudh ""diantar ke tempat anda"" tapi paket masih diajak metur2 berhari2. harusnya langsung dikirim, dan melebihi estimasi pengiriman 3hari. dikomplin di wa enaknya bilang saya sudah pulang …",JNT,Jawa Timur
1,"Tulisan paket sudah diterima oleh saya padahal belum sama sekali, tolong tanya kurirnya yang nganterin ke DEPOT ASIH JAYA samping Bank Jatim, seharusnya menghubungi nomer saya terlebih dahulu tidak asal konfirmasi barang sudah diterima, ini terus gimana? Paket saya gak ada sama sekali, saya sudah cek sekitar, KECEWA",JNT,Jawa Timur
1,Paket bilangnya diantar tp tidak diantar Antar kalo gamau antar seharusnya bilang ini dichat gak dibls ditelpon gak diangkat,JNT,Jawa Timur
1,Kurir sudah d hubungi minta d antar sore aja soalnya paket cod malah d titipin tetangga ! Pdhl pas d wa udh balas siap d antar sore!,JNT,Jawa Timur
1,"Pengiriman lama banget, paket dari surabaya aja bisa berhari-hari. Pas udah sampe di lamongan nggak dikirim kurir malah muncul ""pesanan ditahan sementara karena toko atau kantor sudah tutup"". Menjengkelkan",JNT,Jawa Timur
1,"Status paketan sudah dianter tpi gak sampai ke rumah, niat ambil sendiri ke kantornya malah pelayanan gak ramah.
Bilang lagi overload gk bisa ngecekin.
Payah",JNT,Jawa Timur
1,"Bukan berarti customer adalah raja, tapi semua orang punya prinsip ""waktu adalah uang"". Request pickup tak kunjung diambil. Kasian buyer/penerima nunggu paket lama. Sorry banget nih, ditingkatkan yah kualitas pelayanannya.",JNT,Jawa Timur
1,Mau tanya apa ada nomor kurir atau pihak lain yang bisa dihubungi. Cek resi paket saya sudah diterima tapi saya belum menerima sampai sekarang. Saya sudah dm jnt bilangnya akan ditindak lanjuti tapi sampai sekarang tidak ada kabar. Mohon kejelasannya,JNT,Jawa Timur
1,"Kali ini saya kecewa banget sama J&T, masa dari Karanggeneng ke Glagah saja dua hari gak nyampai, kirim tgl 8 Juni, tanggal 10 malam update resi masih di gudang,,, padahal satu kota.",JNT,Jawa Timur
1,"Paket saya dr Jakarta saya cek resi udah nyampe Lamongan,masak telpon ga keangkat ajanbarang direturn ke jkrta lagi,gunanya alamat lengkap itu apa coba...aneh2..",JNT,Jawa Timur
1,"Ada pengalaman gak enak , kurir tidak mau mengantar kerumah dan di sutuh ambil ke kantor
Dan nyuruh retur",JNT,Jawa Timur
1,"Sangat kecewa, paket sudah sejak pagi di drop point, ditunggu sampai sore tpi gk diantar ke rumah padahal rumah masih kota dan gk jauh dari drop point.
Lebih kecewa lagi saat saya tanya langsung ke drop point terbukti pelayanan …",JNT,Jawa Timur
1,"Kenapa yah sekarang JnT kualitasnya sangat sangat menurun? biasanya sehari sampai, kalau beli shopee selalu pilih JnT tp untuk sebulan terakhir ini bener2 menghindari jasa kirim JnT kalau ada pilihan lain karena makin lama dalam pengiriman",JNT,Jawa Timur
1,Ngehubungi J&T  via WA atau telfon gabisa dan ditolak. Disamperin ke lokasi bilang kalau gabisa sudah tutup gabisa nyariknya soalnya banyak. Trus tak tanyai tadi kok tulisannya dikembalikan ke gudang. Jawaban nya oh sudah dibawak kurir tapi …,JNT,Jawa Timur
1,"Pelayanan sangat buruk. Cek resi udah dibawa kurir, udah 4 hari nggk dianter2. Ditelpon nggk diangkat dichat cuma diread. Kayak menghindar padahal barang sangat dibutuhkan.",JNT,Jawa Timur
3,Problem jasa pengiriman di lamongan sepertinya terletak di manajemen dan personal pegawainya. Seperti tidak bisa kerja cerdas dan efisien. Etos kerja jg kurang serta mgkin tidak ada pelatihan pelayanan ke customer. Jadinya ya banyak yg …,JNT,Jawa Timur
1,"Kurir e piye seh Iki di wa GK respon. Katae ditanda trima sek lek smpk jm 5 sore GK diantr onk denda e lah kg GK diantr'"" main klik aja kalau Uda tak trima.. ditanda trima kemarin jm 11 siang lah smpk sekrng kurire mbulet ruwett",JNT,Jawa Timur
3,"J&t lamongan pengiriman lelet
Paketan udah 3 hari masih stay di gudang
Padahal order dari surabaya. Dari j&t surabaya oke cepat. …",JNT,Jawa Timur
1,"Kecewa sekali sekarang. Paket sudah sampai dari tgl 6 Mei 2021. Dan siang itu statusnya di antar.,tapi sorenya status paket kembali ke pusat sortir.tgl 7 dan 8 juga seperti itu. Tapi sampai tgl 9 statusnya masih di antar tapi tidak sampai2 rumah saya. Ini maksutnya kenapa kog tidak sampai-sampai?",JNT,Jawa Timur
1,"Parah ini sih, kalau ngga niat usaha tutup aja, ngerugiin banyak orang. Paket sudah di lamongan aja dibawa muter kesana kemari pdahal sama2 lamongan ini dan sudah lamaaaaaa gk nyampe2. Amat sangat tidak direkomendasikan terlebih kurirnya, kalau sesama lamongan atau tujuan lamongan JANGAN PAKAI J&T !!",JNT,Jawa Timur
1,Tolong kpd kurir yg nama nya gunawan kinerja nya di perbaiki lagi . Masak paketan sdh di bawa selama 2hr tp gak segera di anter kerumah . Smpyan nganter paketan muter lewat pantura ta ? …,JNT,Jawa Timur
1,"Order online selanjutnya mikir2 dulu lah kalau pake expedisi j&t,, sangat mengecewakan udah biaya mahal, waktu pengiriman hampir 2 hari padahal jarak antara Lamongan kota ke kalitengah cuma butuh waktu 35 menit... mohon pelayanan nya di …",JNT,Jawa Timur
1,"Sangat amat kecewa sama pelayanannya.. kurirnya yang ngakunya bukan dia yang ngantar, paket saya tertahan 3 hari.. padahal ket diantar terus, kurir yang gatau alamat padahal sudah tertera",JNT,Jawa Timur
3,"Assalamualaikum..sya barusan juga komplain kpd penerima barang resi,kesalahan di cetak tak suruh cetak ulang malah saya kena suara nanda tinggi sma petugas.. ntar klo salah kirim bgaimna.. mohon di tindak tegas.. foto bukti saya kirim …",JNT,Jawa Timur
2,Dari dulu suka pake jasa j&t karena cepat tapi sekarang gatau kenapa kinerjanya menurun kalo mau anter paket cod selalu konfirmasi dulu kalo mau ke rumah sekarang gk konfirmasi tautau bilang dirumah gk ada orang dan disuruh ambil ke kantornya,JNT,Jawa Timur
5,"Alhamdulillah..selama pake j&t selalu puas dengan pelayanannya, barang langsung diantar di hari yang sama jika memungkinkan.. semoga kedepannya lebih baik lagi",JNT,Jawa Timur
1,"Baru saja saya masuk area j&T, niat hati hanya tanya terlebih dahulu untuk pengiriman apa masih bisa atau sudah tutup, ketika bertanya respon orang 1 dan 2 baik, tetapi salah satu selain 2 org ini menuju depan menutup gerbang dengan keras …",JNT,Jawa Timur
1,"Gila sih ini..
Baru sekali pake J&T..dan sangat mengecewakan..
Paketan sudah lebih dari 6 hari gak Sampek... …",JNT,Jawa Timur
1,Pelayanan sangat buruk. Mohon di perbaiki. Kirim pagi dua hari baru di proses. Itu saja kalau ditlp. Hadeh,JNT,Jawa Timur
2,"Selamat Pagi .
Saya ingin memberitahukan bahwa pesanan saya kenapa tidak sampai dan disitu tertulis paket gagal dikirim karena saya tidak ditempat . …",JNT,Jawa Timur
1,"Sama"" membutuhkan jadi mohon saling pengertian lah ya! Udah bayar ongkir tpi kirimnya lamaa. Disuruh kirim kesini dulu bilangnya nanti pulang malam! Ya kalo gak mau kerja pulang malam tolong dong jam kerjanya diatur yg baik, wktunya kerja bukan kerja malah ngopi. Sumpah gak habis fikir!!",JNT,Jawa Timur
2,Paket saya sampai sekarang belum juga sampai.. Dua hari yg lalu dapat sms dari jnt katanya besok diusahakan sudah dikirim tp ternyata sampai sekarang pun belum.. Saya coba hubungitidak direspon. Sangat mengecewakan,JNT,Jawa Timur
1,"Ini paketan saya di status resi paketan sudah diterima tanggal 2 agustus 2020, tapi sampai sekarang tidak ada paketan sampai kerumah,  ini paketannya dikirim kemana??  Saya rasa alamat yg tertera sudah sangat jelas,  mohon penjelasnnya.",JNT,Jawa Timur
1,Tolong untuk pihak expedisi pengantar barang J&T LAMONGAN agar diperhatikan kinerja saat pengiriman barang soalnya tidak hanya satu kali menjadi kendala disaat pengiriman. banyak yg mengeluh barang yang diantar dari tempat gudang J&T …,JNT,Jawa Timur
1,Pelayanan buruk. Paketan lari kemana2. Seharusnya lgsg dikembalikan di jnt pusat bukan malah ditaruh kurirnya. Dan kurirnya gak antar lagi. Sudah nyuruh cak ed kesana eh malah barang masih dikurir. Pelayanan juga tidak ramah.,JNT,Jawa Timur
1,"Barang saya sudah 5 hr d gudang sortir.
Iki ketlisut ta piye bos. Kok poleh ngne peformane",JNT,Jawa Timur
1,"status paket tidak jelas
kalau uda ada barang refund dari kurir ngak mau di tanggulangi
csnya buruk gw di usir dari gudang katanya barang akan di antar tp ngak dateng
uda tutup aja kalo ngak niat",JNT,Jawa Timur
1,Pelayanan Customernya buruk,JNT,Jawa Timur
1,Buruk sskali saya kirim dengan kode booking dari shoppe akan tetapi tidak kunjung di kirim . Tidak ada kabar sama sekali . Salah satu cara ya harus ke kantornya langsung seburuk ini kah dengan customer setianya ssharusnya di kabari lewat no hp atau email di shoppe,JNT,Jawa Timur
3,"Pesan gak sampai sampai rumah meski di track sudah sampai lokasi. Tapi hingga hari kedua belum juga sampai rumah. Akhirnya saya ambil di gudang nya. Ambil sendiri. Pelayanan kepada pelanggan di gudang kurang , barangkali ada CS yg real ramah",JNT,Jawa Timur
5,"Sampai saat ini, j&t menjadi salah satu ekspedisi pikuhan saya. Pelayanan dan pengiriman cepat. Belum ada keluhan berarti terkait pelayanan dan pengiriman. Sip",JNT,Jawa Timur
2,Pelayanan buruk.. Kurirnya kurang ramh.. Sering salah kirim paket dan kurang tanggung jawab.. Tolonglah di perbaiki lagi...,JNT,Jawa Timur
1,"Pelayanan lambat, barang tidak kunjung sampai. Kurir sudah dikerahkan namun belum tiba sampai estimasi barang melewati waktunya",JNT,Jawa Timur
3,Baru kali ini paket di j&t saya miss route biasanya gk pernah selalu memuaskan🙏🏻 mohon segera ditindak lanjuti paket saya yg berada tdk dijalurnya🙏 …,JNT,Jawa Timur
2,"Duh kurirnya gak SOPAN BANGET gedor"" pintu, buka pintu sendiri ,paketku di lempar lagi.. Dah tau saya punya anak masih bayi posisi ortu lagi sakit lagi. Gusti ampun deh …",JNT,Jawa Timur
1,"untuk pengambilan di lokasi dibatasi jam 09.00-15.00 saja (saya ke lokasi per tanggal 06 januari 2021)
customer service di frontliner kurang ramah kepada pelanggan
pelayanan di kantor benar-benar buruk dan mengecewakan",JNT,Jawa Timur
1,"pelayanan sangat tidak ramah, karyawan bersikap semenah menah",JNT,Jawa Timur
1,"Pelayanan buruk, admin kurang ramah dan apatis. Sama orang saja seperti iku apalagi sama barang.",JNT,Jawa Timur
1,"pelayanan buruk, selalu susah diminta cetak resi untuk pengiriman dengan resi otomatis, yg jualan di marketplace pilihan jnt dimatikan saja biar mampus, yg jualan di shopee bukalapak tokopedia jangan mau meninggalkan barang kalo tdk diberi …",JNT,Jawa Timur
1,"Saya hari senin, 30 maret 2020 jam 16.00 kirim 9 buah paket shopee, sampai jam 23.11 kok blm terkonfirmasi di shopee? Bgmn pelayanan ini",JNT,Jawa Timur
1,"Paket saya ini gma ditulisannya sudah diterima sng pemilik runah tapi paketnya gak ada yg kesini. Trus ini paketnya  dikirim kemanaaa... padahal udah jelas""ada alanat rumah dan no telfon yg benar",JNT,Jawa Timur
1,"Kurir nya ramah😀
Dikit” nyuruh retur padahal baru sampe sehari …",JNT,Jawa Timur
1,"Pelayanan tidak ramah, tidak seperti jnt kota lain, bahkan paket yg baru dimasukkan langsung dilempar didepan pengirimnya",JNT,Jawa Timur
5,"Mungkin tempat parkirnya harap di perhatikan....
Sistem pelayanannya harap di perhatikan juga..
CUSTOMER SERVICE kurang memuaskan seharusnnya ada greeting dulu ini tidak ada
Trus strukturnya untuk pengambilan maupun pengiriman masih rancau...",JNT,Jawa Timur
1,Kak paket aku kok blm di antar*,JNT,Jawa Timur
1,"Kirim barang dari sby-tbn selalu pake jnt tapi akhir2 ini lama banget kalo uda sampe lamongan, tolong diperbaiki lagi, udah banyak loh yg ngeluh, mau nunggu bangkrut apa gmn ?",JNT,Jawa Timur
1,"Barang udah digudang lamongan sejak pagi, tp ga langsung dikirim ke alamat tujuan Babat, harus nunggu esok harinya baru dikirim balik lg ke Sby, baru dilempar lg ke lamongan. Meleset dr target 2-3 hari sampai.",JNT,Jawa Timur
1,"Gak jelas..
Kantor masih ada orang tp bilangnya tutup...
Admin cewek 2 gak ada ramah2nya",JNT,Jawa Timur
